name	slug	address	city	postcode	phone	email	website	capacity	has_women_section	has_parking	has_wudu	description
SLEAFORD ISLAMIC CENTRE	sleaford-islamic-centre			NG34 7RG	01529701818	sleafordislamiccentre@gmail.com	https://www.sleafordislamiccentre.org	0	0	0	1	Based in a newly built building at the centre of Sleaford, the purpose of the centre is to serve a growing and diverse Muslim community in and around Sleaford. The centre offers a range of activities including religious services, educational activities and other welfare projects. The centre is welcoming of both Muslims and non- Muslims to learn about the Islamic Faith.
WATFORD ISLAMIC FOUNDATION TRUST	watford-islamic-foundation-trust			WD17 4TA	07894338415	m.hye@hotmail.co.uk	https://www.wift.org	0	0	0	1	Place of worship and community activity
NIGERIAN MUSLIM ASSOCIATION IN COVENTRY (NIMAC) WELFARE TRUST	nigerian-muslim-association-in-coventry-nimac-welfare-trust			CV3 3AN	07412642895	nimaconline.org@gmail.com	https://www.nimaconline.org	0	0	0	1	Activities of teaching islamic studies, social Islamic integration and prayer meetings.
BIRMINGHAM ANJUMAN-E-ISLAM MASJID TRUST	birmingham-anjuman-e-islam-masjid-trust	BIRMINGHAM	BIRMINGHAM	B6 6AG	01215549157	enquiry@birminghamjamemasjid.org.uk	https://www.birminghamjamemasjid.org.uk	0	0	0	1	To advance the religion of Islam by means of, but not exclusively. To arrange or help in the provision of facility for Islamic Worship, Islamic Education, Celebration of Islamic Festivals, Marriages, Burials in accordance with the teaching of the Quran and the Sunnah of the Prophet Muhammed (Peace be Upon Him) as interpreted by the Sunni Deobandi School of Thought.
LIVERPOOL MUSLIM OUTREACH SOCIETY (LMOS)	liverpool-muslim-outreach-society-lmos			L18 7HE	07542682447	contact@livmuslim.org	https://www.LivMuslim.org	0	0	0	1	As an expression of the Islamic faith, Liverpool Muslim Outreach Society (LMOS) is involved in the relief and prevention of poverty in Liverpool but not exclusively by the provision of practical advice, food, basic essential items and support inaccessing services.  LMOS serves the most disadvantaged in society through its weekly visit to Asylum Centres and homeless feeds in the city centre.  
MUSLIMS AGAINST ANTISEMITISM	muslims-against-antisemitism			SW1A 1RN	0000000000	info@muslimsagainstantisemitism.org	https://www.muslimsagainstantisemitism.org	0	0	0	1	THE PROMOTION OF RELIGIOUS AND RACIAL HARMONY FOR THE PUBLIC BENEFIT, PARTICULARLY (BUT NOT EXCLUSIVELY) AMONG MUSLIM AND JEWISH COMMUNITIES IN ENGLAND AND WALES, BY: (A) PROMOTING KNOWLEDGE, MUTUAL UNDERSTANDING AND RESPECT OF THE BELIEFS AND PRACTICES OF DIFFERENT RELIGIOUS GROUPS; (B) ADVANCING EDUCATION AND RAISING AWARENESS ABOUT DIFFERENT RELIGIOUS AND RACIAL GROUPS TO PROMOTE GOOD RELATIONS
MUSLIM KHOJA SHIA ITHNA-ASHERI COMMUNITY OF LEICESTER	muslim-khoja-shia-ithna-asheri-community-of-leicester			LE5 3LR	01162769896	secretary@mksileicester.org	https://www.mksileicester.org	0	0	0	1	THE OBJECT OF THE COMMUNITY IS TO PROMOTE AND ADVANCE BY ANY SUCH MEANS AS ARE ACCORDING TO THE LAWS OF ENGLAND EXCLUSIVELY THE ISLAMIC RELIGION IN ACCORDANCE WITH THE PRINCIPLES OF SHIA ITHNA-ASHARI SHARIA TO PROVIDE RELIEF TO THE POOR MEMBERS OF THE FAITH.
Darul Noor Islamic Centre	darul-noor-islamic-centre	Barnet	Barnet	EN5 5XE	07442444554	info@darulnoor.org.uk	https://www.darulnoor.org.uk/	0	0	0	1	Darul Noor Islamic Centre is charity register no 1190170 in Barnet.
ISLAMIC INFORMATION CENTRE BRISTOL	islamic-information-centre-bristol			BS5 6PA	01179020037	info@islamicinformationcentre.co.uk	http://www.islamicinformationcentre.co.uk/	0	0	0	1	General Community cohesion projectsPropagation of Sufi IslamInterfaith projectsTeaching of: Arabic language, Islamic educationGeneral Islamic information and supportCareers Advice support for Refugees & Wider CommunityDigital Based Arabic TeachingPublication of Islamic literature
MADINA MOSQUE	madina-mosque	BOLTON	BOLTON	BL1 2BZ	01204521691	madinamosquebolton@gmail.com	http://madinamosquebolton.org	0	0	0	1	1. RELIGIOUS WORSHIP AND PRAYER FACILITIES2. EDUCATION AND MADRASAH3. RELIGIOUS SERVICES FOR WEDDINGS, NIKAH, BIRTHS AND DEATHS4. COMMUNITY SOCIAL AND RELIGIOUS GATHERINGS5. RELIGIOUS COUNSELLING AND GUIDANCE
THE SLOUGH ISLAMIC TRUST	the-slough-islamic-trust	78 DIAMOND ROAD	78 DIAMOND ROAD	SL1 1RX	+441753535239	thesloughislamictrust@gmail.com	https://sloughislamictrust.org/	0	0	0	1	The main activities of the Charity are holding the 5 daily prayers at our two Mosques, the weekly jumu'a Friday prayer, the tarawih prayers in Ramadan and the 2 annual 'Id prayers. We provide Islamic education to children between the ages of 5 and 16 and knowledge about the teachings of Islam for whoever who seeks it. We assist in feeding the hungry and relieving the poor by distributing zakat.
MUSLIM HELPING HAND	muslim-helping-hand			N17 8HP	07901332955	islam_uddin123@hotmail.co.uk	https://muslimhelpinghand.com/	0	0	0	1	charity  activities to society
LIVERPOOL REGION MOSQUE NETWORK	liverpool-region-mosque-network	Wirral	Wirral	CH42 0HA	07525655618	info@lrmnet.org.uk	https://www.lrmnet.org.uk	0	0	0	1	TO ADVANCE THE ISLAMIC FAITH THROUGH REPRESENTING MOSQUES AND ISLAMIC CENTRES OF THE LIVERPOOL CITY REGION UNDER THE STRUCTURE OF ONE NETWORK. IN DOING SO ACTIVITIES WILL INCLUDE PROMOTING UNDERSTANDING AND UNITY AMONGST THE VARIOUS MOSQUES AND ISLAMIC CENTRES; AND PROMOTING RACIAL AND RELIGIOUS HARMONY BETWEEN MUSLIMS AND NON-MUSLIMS
MARKAZI JAMIA MASJID GHAUSIA	markazi-jamia-masjid-ghausia	HUDDERSFIELD	HUDDERSFIELD	HD1 3RT	01484513248	admin@masjidghausia.org	https://www.masjidghausia.org	0	0	0	1	To advance the Islamic faith for the benefit of the public through providing a place of worship, religious services, broadcasting Islamic messages of an evangelistic and teaching nature and producing and/or distributing literature on Islam to enlighten others about the Islamic religion.
MARKAZI JAMIAT AHL E HADITH	markazi-jamiat-ahl-e-hadith	BRADFORD	BRADFORD	BD8 7RZ	07946444430	themasjid@live.com	https://muhammadimasjid.co.uk	0	0	0	1	Five Islamic prayers undertaken through day for the community to attend. Quran (Holy book) and Islamic scripture education classes for adults and children. Marriage ceremonies. Funeral prayer services. Educational lectures. Community cohesion days. Fun days for the community.
MUSLIM FUTURES	muslim-futures	(BY APPOINTMENT ONLY)	(BY APPOINTMENT ONLY)	IG2 6RE	07553554724	info@muslimfutures.org	https://www.muslimfutures.org	0	0	0	1	Working internationally to support the needy and vulnerable, sick, disabled, widowed and orphaned. We alleviate poverty and hardship, by improving access to essential life-critical services, personal development and self-empowerment. Our areas of work include:Education & Literacy.Children & Youth.Widows & Orphans.Sick & Disabled.Vulnerable & Homeless.Skills & Training.
DARUL HADIS LATIFIAH NORTHWEST	darul-hadis-latifiah-northwest	PLUM STREET	PLUM STREET	OL8 1TJ	01616274422	info@dhlnw.org.uk	https://dhlnw.org.uk/	0	0	0	1	TO ADVANCE THE SECONDARY SCHOOL EDUCATION OF THE PUPILS AT DARUL HADIS LATIFIAH NORTHWEST, IN ACCORDANCE WITH THE PRINCIPLES AND DOCTRINES OF THE ISLAMIC FAITH, IN PARTICULAR BUT NOT EXCLUSIVELY, BY THE PROVISION OF A SCHOOL TO DEVELOP A NEW GENERATION OF BRITISH MUSLIMS AS WELL AS BENEFITING LOCAL COMMUNITY AT LARGE.
THE NATIONAL MUSLIM WAR MEMORIAL TRUST	the-national-muslim-war-memorial-trust			N14 6RD	020 8882 0227	mail@muslimwarmemorial.org	https://www.muslimwarmemorial.org	0	0	0	1	Our mission is to erect and maintain a public national war memorial to commemorate the service of Muslims in Britain's Armed Forces during the two World Wars and subsequent conflicts.Our charity will also help to educate the public about the contribution of Muslims to Britain's Armed Forces through their role, service and sacrifice during both World Wars and subsequent conflicts.
CUTCHI SUNNI MUSLIM ASSOCIATION (BIRMINGHAM)	cutchi-sunni-muslim-association-birmingham	BIRMINGHAM	BIRMINGHAM	B20 2LP	07853208506	info@csmabirmingham.co.uk	https://www.csmabirmingham.co.uk/	0	0	0	1	The Association aims is to serve the Cutchi people of West Midlands who are a minority in the UK by providing them community services as encapsulated in the Objects below: The advancement of education (IT, English Language, Health and Dietary, Faith, etc) To encourage and develop social and sporting activities, which will encourage more people to get active and stay healthy. Organise Trips
AL-IHSAAN ISLAMIC ASSOCIATION	al-ihsaan-islamic-association			B19 3AG	07588512060	abubakar17@hotmail.co.uk	https://al-ihsaan.uk	0	0	0	1	Empowering the youth through vocational skills
MUSLIM CULTURAL & WELFARE ASSOCIATION OF SUTTON (MCWAS)	muslim-cultural-welfare-association-of-sutton-mcwas	SURREY	SURREY	SM5 3DH	07340973571	email@mcwas.org	http://www.mcwas.org	0	0	0	1	The objects of the charity are set out in the Charity's constitution namely: to promote the Islamic religion, to advance public education in Islamic literature and culture, to promote any other charitable purpose for the benefit of Muslims resident in the London Borough of Sutton
YOUNG MUSLIM & COMMUNITY ORGANISATION	young-muslim-community-organisation	NEWPORT	NEWPORT	NP19 7EH	07458639565	INFO@YMCO.ORG.UK	https://YMCO.ORG.UK	0	0	0	1	    General Charitable Purposes    Education/training    Religious Activities    Economic/community Development/employment
MUSLIM FORUM OF BRITAIN (MFB)	muslim-forum-of-britain-mfb	Bristol	Bristol	BS7 0UW	07828249752	info@muslimforumofbritain.co.uk	https://muslimforumofbritain.co.uk	0	0	0	1	We support Muslims to understand and practice their religion in their context. We do these through education training and information dissemination.
SLOUGH MUSLIM TRUST	slough-muslim-trust	Slough	Slough	SL1 3DW	01753398195	sloughmuslimtrust@gmail.com	https://www.sloughmuslimtrust.org	0	0	0	1	Will update it soon
ISLAMIC ACADEMY & DA'WAH CENTRE	islamic-academy-dawah-centre	MILTON KEYNES	MILTON KEYNES	MK2 3ET	07595936891	iadc.charity@gmail.com	https://iadc-org.co.uk	0	0	0	1	The charities main purpose is to provide Islamic Education to the community via online methods and face to face. This includes outreach activities such as community and open days for all. We also raise money for charities of our choosing. We mainly operate local to the charities registered address and plan to operate nationally in the future.
CENTRE FOR MUSLIM POLICY RESEARCH	centre-for-muslim-policy-research			HA4 4HY	07506026664	info@cmpr.org.uk	https://www.cmpr.org.uk	0	0	0	1	Publish evidence based research, policy briefings and seminal papers
CHATHAM AND ROCHESTER MUSLIM COMMITTEE	chatham-and-rochester-muslim-committee			ME4 6QG 	01634880571	administrator@masjidulabraar.org	https://masjidulabraar.org	0	0	0	1	PROVISION OF ISLAMIC CENTRE FOR THE BENEFIT OF ALL PUBLIC
THORNTON HEATH ISLAMIC CENTRE	thornton-heath-islamic-centre	THORNTON HEATH	THORNTON HEATH	CR7 8SN	07768018964	purecap@hotmail.co.uk	https://www.thislamiccentre.org	0	0	0	1	The provision or assistance in the provision of facilities of Islamic education and worship in accordance with the teachings of the Quraan and the Sunnah of the Prophet Muhammad (Peace be upon him).To relieve financial hardship, distress, and suffering among poor people and other people in needTo advance education for the benefit of the general public.
GREENGATE JAMIA MASJID	greengate-jamia-masjid	ASHTON UNDER LYNE	ASHTON UNDER LYNE	OL7 0NB	07979866369	greengatejamiamasjid@gmail.com	http://www.greengatejamiamasjid.com/	0	0	0	1	NA
NOTTINGHAM MUSLIM WOMEN'S NETWORK	nottingham-muslim-womens-network	Foxhall Road	Foxhall Road	NG7 6LH	01158372627	enquiries@nmwn.co.uk	https://nottinghammuslimwomensnetwork.co.uk	0	0	0	1	We are a diverse network of Muslim women based in Nottingham, sharing knowledge and voicing the needs of Muslim women in a safe environment, providing a platform to ensure they are included in the decision making processes that influence local policy and development of services. We offer a monthly legal advice service. DV support and outreach service.
EASE: MUSLIM FUNERAL SUPPORT	ease-muslim-funeral-support	LANCASHIRE	LANCASHIRE	OL4 1DZ	07823486021	info@easemfs.org	https://www.easemfs.org	0	0	0	1	The charity helps those in financial need to bury their loved ones. we are UK based and generally focus in the North West/Greater Manchester. Muslim funerals are very specific, the body needs to be washed, shrouded and buried and cannot be cremated therefore if the family cannot afford this, they will come to use and we would pay to the funeral directors.
BALHAM MASJID AND TOOTING ISLAMIC CENTRE.	balham-masjid-and-tooting-islamic-centre			SW12 9AW	02034098054	admin@balhammosque.org	http://www.balhammosque.org/	0	0	0	1	
COMPANIONS OF THE MOSQUE	companions-of-the-mosque	Sutton	Sutton	SM1 4DP	02086420803	admin@companionsofthemosque.com	https://www.companionsofthemosque.com	0	0	0	1	1. Eid in the Park We carry out Eid in The Park event twice a year for Eid ul Fitr and Eid ul Adha2. Jumuah (Friday Prayers) We provide Jumuah prayer service and Sermon every Friday at Thomas Wall Centre3. Taraweeh (Ramadan Nightly Prayers) We provide Taraweeh prayer service (8 Rakats) in the Month of Ramadan4. Islamic Knowledge a. Friday Circle - Hadith Studyb. Tajweedc. Tafseer
SHROPSHIRE ISLAMIC FOUNDATION	shropshire-islamic-foundation	Wellington	Wellington	TF1 1NZ	07814611332	TELFORDCENTRALMOSQUE@GMAIL.COM	https://www.telfordcentralmosque.com	0	0	0	1	Daily prayers,  Islamic education, place for spiritual and religious guidance , community activities
GREATER MANCHESTER COUNCIL OF MOSQUES	greater-manchester-council-of-mosques			OL16 1SB	01706655322	info@gmcom.org	https://www.gmcom.org	0	0	0	1	Through constructive dialogue, engagement, and collaboration with local organisations, faith groups, and stakeholders, we endeavour to promote knowledge, respect, and cooperation among diverse communities, bridging cultural and religious divides for a united and inclusive Greater Manchester.
AL-MUKHBATEEN MASJID & FUNERAL SERVICE	al-mukhbateen-masjid-funeral-service	LONDON	LONDON	W12 8BP	07771075760	almukhbateenmasjid@gmail.com	http://almukhbateenmasjid.org.uk/	0	0	0	1	Five daily congregational prayers for Muslims
MUSLIM SPORTS FOUNDATION	muslim-sports-foundation	83-85 Hagley Road	83-85 Hagley Road	B16 8QG	07874865298	admin@muslimsportsfoundation.org.uk	https://www.muslimsportsfoundation.org.uk	0	0	0	1	Muslim Sports Foundation is the leading grassroots organisation innovatively seeking to inspire, guide and facilitate communities to implement healthy, active lifestyles. Our prioritised focus is planted at grassroots level community engagement within a safe, diverse, and ethically cohesive environment.
STEVENAGE MUSLIM COMMUNITY CENTRE	stevenage-muslim-community-centre	STEVENAGE	STEVENAGE	SG1 5PZ	01438350865	info@smcc786.org	https://www.smcc786.org	0	0	0	1	SMCC is the representative body for the Muslims in the East and North Herts. The Charity is a Mosque and a community centre, providing facilities for community services, Islamic education for children and classes for learning the Holy Qur'an and Arabic. It organises discussions, lectures and meetings on religious topics to the community and accommodates local schools for religious education.
SUTTON COLDFIELD MUSLIM ASSOCIATION	sutton-coldfield-muslim-association	Lichfield Street	Lichfield Street		01215721128	info@suttonmuslims.org.uk	https://www.suttonmuslims.org.uk	0	0	0	1	The charity is faith based and carries out its activities to fulfil the social, cultural, educational, charitable and religious needs of the community.It is non political and doesn't ascribe to any particular sect. It provides supplementary education, advice and advocacy and work to improve community relations.
MUSLIM WELFARE INTERNATIONAL	muslim-welfare-international	BLACKBURN	BLACKBURN	BB1 3BL	01254694015	info@mwinstitute.co.uk	https://mwinstitute.org.uk/	0	0	0	1	The MWI aims & objectives are to establish short-term and long-term projects in developing countries in the fields of Education, Medicine, Welfare & Relief, Rehabilitation and other projects which benefit the people in their time of need. The MWI focuses in countries as follows ,Albania, Macedonia, Bosnia, Bangladesh, West Bengal  and UK.
ILFORD MUSLIM SOCIETY CIO	ilford-muslim-society-cio	ILFORD	ILFORD	IG1 4JE	02084780347	info@ilfordmuslimsociety.org	http://www.ilfordmuslimsociety.org/index.shtml	0	0	0	1	
ISLAMIC BURIAL & WELFARE SERVICES	islamic-burial-welfare-services	LANCASTER	LANCASTER	LA1 4LX	07355001949	contact@ibws.org.uk	https://ibws.org.uk/	0	0	0	1	The advancement of the Islamic faith by providing financial assistance to members of the Muslim community to enable them to observe Islamic principles and practices relating to the burial of the deceased where they may otherwise lack the financial means to do so and the provision of counselling and support for people suffering from bereavement or loss.
MUSLIM BURIAL COUNCIL OF NORTH KIRKLEES	muslim-burial-council-of-north-kirklees			WF12 9LA	07825414755	info@muslimburialcouncil.org	https://www.muslimburialcouncil.org	0	0	0	1	Based in North Kirklees, we offer a compassionate Muslim bereavement service. Rooted in the community, we maintain facilities and provide education on Islamic funerals, ensuring dignified and timely final rites. Collaborating with stakeholders, local and national bodies for seamless service provision. Our commitment ensures accessible Islamic burials, aligned with our faith and principles.
RUSHMOOR MUSLIM ASSOCIATION	rushmoor-muslim-association	FARNHAM	FARNHAM	GU10 1EN	07717478323	committee@rushmoormuslimassociation.org	https://www.RushmoorMuslimAssociation.org	0	0	0	1	The establishment, provision of place for congregational worship, to facilitate Islamic rites such as marriage, Shahadah, Burial;Collaborate with interfaith communities promoting toleranceBuild bridges & drive a positive change in supporting civic improvements by working with Rushmoor Council& Community GroupsAdvice community ,relieve persons who are in conditions of need, hardship& distress
JALALIA JAAME MOSQUE	jalalia-jaame-mosque	Rochdale	Rochdale	OL16 2EB	01706646822	info@jalaliajaamemosque.org.uk	https://HTTPS://WWW.JALALIAJAAMEMOSQUE.ORG.UK/	0	0	0	1	Jalalia Jaame Mosque was established in 1971 and continues to be used by the ever-growing community as a place for solace and spiritual development. The Mosque can accommodate up to 1500 worshippers and offers a range of services from daily prayers to education and funeral services for the community.
BIRMINGHAM MASJID AND DAWAH CENTRE	birmingham-masjid-and-dawah-centre	BIRMINGHAM	BIRMINGHAM	B19 2DR	01212572556	bmdcmasjid@gmail.com	https://bmdcmasjid.org.uk	0	0	0	1	Advance the faith of Islam by providing prayer facility for Muslim living in Birmingham City.   Organise Quran club for  Muslim children to educate them about Islam. Organise Open Days for the community to raise awareness about Islamic faith.
MASJID-E-GHOSIA	masjid-e-ghosia	BOLTON	BOLTON	BL3 6SX	07897 781868		https://WWW.GHOSIA.CO.UK	0	0	0	1	Advance the religion of Islam in accordance with the laws dictated in the Quran, the Sunnah and the Hanafi Sunni school of thought and beliefs, as per the institution of Ahle-Sunnat-Wa-Jama'at. Provision of facilities and services including but not limited to: -Daily congregational prayers -Education & development -Nikah services -Funeral services -Promote harmony - & counteract extremism
JAMIA NIZAMIA CHARITY	jamia-nizamia-charity			DE23 8QE	07938892763	info@nizamia.org.uk	https://www.nizamia.org.uk	0	0	0	1	The charity offers outstanding educational & cultural services, Islamic counselling, seminars, and events for the youth and the community of Derby, alongside a fully functioning mosque with daily prayer services, Islamic classes and Friday sermons.  The Nizamia Foundation is the perfect place to foster the hearts and minds of British Muslims.
ALTON ISLAMIC CENTRE LTD	alton-islamic-centre-ltd	AMERY STREET	AMERY STREET	GU34 1HN	07810522928	altonislamiccentre@gmail.com	https://www.altonislamiccentre.org	0	0	0	1	Hold and arrange friday prayers .
SOUTH EAST KENT ISLAMIC CULTURAL CENTRE	south-east-kent-islamic-cultural-centre			CT20 1HJ	01303311438	info@folkestonemosque.com	https://folkestonemosque.com/	0	0	0	1	TO ADVANCE THE ISLAMIC RELIGION FOR THE BENEFIT OF THE PUBLIC THROUGH:- (A) THE PROVISION AND MAINTENANCE OF A MOSQUE FOR PUBLIC WORSHIP ACCORDING TO ISLAM (B) THE PROVISION AND MAINTENANCE OF AN ISLAMIC CULTURAL CENTRE FOR THE MUSLIM AND WIDER COMMUNITIES IN KENT AND SURROUNDING AREAS (C) THE ADVANCEMENT OF EDUCATION IN THE PRINCIPLES OF THE FAITH OF THE ISLAMIC RELIGION, ITS DISTINCTIVE FEATURES
DARUL HADIS LATIFIAH FOUNDATION	darul-hadis-latifiah-foundation	LONDON	LONDON	E2 0HW	02089802673	enquiry@darulhadis.org.uk	https://www.darulhadis.org.uk	0	0	0	1	Darul Hadis Latifiah Foundation is established to develop and deliver Islamic education and guidance alongside the British National Curriculum for pupils aged between 11 and 20. Darul Hadis Latifiah Islamic School & College in London is the first project that the foundation will undertake.
NEW MALDEN MUSLIM ASSOCIATION	new-malden-muslim-association	NEW MALDEN	NEW MALDEN	KT3 6AU	07384507438	INFO@NMMA.ORG.UK	https://www.nmma.org.uk	0	0	0	1	The charity works to advance Islam for public benefit in the borough of Kingston and surrounding areas. Our efforts include providing regular prayer services, Islamic education programs, and community-based charitable services that promote the pillars of Islam. Through youth clubs, community events, and educational initiatives, NMMA strengthens community ties,fosters spiritual and personal growth.
CHEAM MUSLIM WELFARE SERVICES LIMITED	cheam-muslim-welfare-services-limited	SUTTON	SUTTON	SM2 7AZ	02084012934	contact@basma.org.uk	https://basma.org.uk	0	0	0	1	To advance the Islamic faith particularly in Cheam, Belmont, Sutton, in Surrey, and elsewhere, for thebenefit of the public mainly but not exclusively through the holding of prayer meetings, lectures and publiccelebration of religious festivals.
SOUTH OXFORDSHIRE MUSLIM ASSOCIATION	south-oxfordshire-muslim-association	DIDCOT	DIDCOT	OX11 8RJ	07545269295	office@somadidcot.org	https://somadidcot.org/	0	0	0	1	To establish and advance the Islamic faith in Oxfordshire for the benefit of the public mainly but not exclusively through the provision of a mosque, Islamic education, a celebration of religious festivals, interfaith activity and to provide guidance about the religious and spiritual wellbeing to the local community.
LONDON COLNEY ISLAMIC CENTRE	london-colney-islamic-centre	LONDON COLNEY	LONDON COLNEY	AL2 1JY	03002340786	hello@lcic.org.uk	https://www.lcic.org.uk	0	0	0	1	The charity offers a wide range of services including praying facilities for the Muslim faith. There are also evening sessions for children and adult education including weekend sessions. It does also offer interfaith session from time to time and a food bank to the local community.
CADISHEAD & IRLAM ISLAMIC CENTRE	cadishead-irlam-islamic-centre	IRLAM	IRLAM	M44 5GQ	07414885653	info@irlammosque.org	https://www.irlammosque.org	0	0	0	1	The centre provides a place of worship for people of Muslim faith. It also acts as a meeting place for the congregation. Annual faith based events are also  celebrated there by the local community.
MUSLIM FAMILY AID	muslim-family-aid			N18 1EQ	07808067006	admin@muslimfamilyaid.org	https://www.muslimfamilyaid.org	0	0	0	1	Muslim family Aid solely operates in the UK. We will associate ourselves with other charities that deals internationally when disasters occur with donation of food packs or money, we concentrate on homeless with preparation of food and drink. We sponsor under privileged children to further their studies and also building water well in the most needed countries.
DEWSBURY MOOR MUSLIM ASSOCIATION	dewsbury-moor-muslim-association	West Yorkshire	West Yorkshire	WF13 3NQ	07526538628	faizanemadinapilgrim@gmail.com	https://www.facebook.com/PILGRIMFMM/	0	0	0	1	Faizan e Madina Masjid Pilgrim., Dewsbury. 153 likes · 1 was here. Welcome to Faizan e Madina Masjid's Official Facebook Page. This page has been created...
HUSSAINI ISLAMIC TRUST UK	hussaini-islamic-trust-uk			HA1 4TQ	07483251505	info@arbaeenuk.org	https://www.arbaeenuk.org/	0	0	0	1	London-based Arbaeen Procession commemorating the Tragedy of Karbala and the sacrifices of Imam Al-Hussain...
COLLIER ROW MASJID	collier-row-masjid			RM5 3UU	07446964652	info@collierrowmosque.org.uk	https://www.collierrowmosque.org.uk	0	0	0	1	Operation of an Islamic centre for local people
SHOREDITCH MASJID AND ISLAMIC CULTURAL CENTRE	shoreditch-masjid-and-islamic-cultural-centre			E2 7DJ  	07932860724	shoreditchmasjid@gmail.com	http://shoreditchmosque.com/	0	0	0	1	Daily five times salah in congregations including two Jumu'ah prayers on Friday. Spiritual and religious gathering takes place on weekly basis. Maktab facilities are available for women and children. Yearly one open day for everyone to come and visit the Mosque. Iftar facilities in the holy month of Ramadan.
NORFOLK BRITISH MUSLIM ASSOCIATION LTD	norfolk-british-muslim-association-ltd	Hethersett	Hethersett		07899714173	info@hethersettmasjid.org.uk	https://hethersettmasjid.org.uk/	0	0	0	1	NORFOLK BRITISH MUSLIM ASSOCIATION LTD is dedicated to serving the spiritual and communal needs of the Muslim community in Norfolk. As a place of worship, the mosque offers a serene and sacred environment for the performance of Islamic rituals and prayers. Our activities include:Daily Prayers (Salah), Jumu'ah (Friday) Prayer, Ramadan Services, Eid Prayers, Educational Programs, Community Support
SOUTHGATE MOSQUE AND COMMUNITY CENTRE LTD	southgate-mosque-and-community-centre-ltd			N14 6BS	07956987398	info@southgatemosque.co.uk	https://www.southgatemosque.co.uk	0	0	0	1	
