name	slug	address	city	postcode	phone	email	website	capacity	has_women_section	has_parking	has_wudu	description
THE LONDON CENTRAL MOSQUE (ALGAME) FUND	the-london-central-mosque-algame-fund	146 PARK ROAD	146 PARK ROAD	NW8 7RG	02077252152	info@iccuk.org	https://www.iccuk.org	0	0	0	1	To provide a place of worship for the multi-ethnic community of Muslims in London and Britain.To propagate and extend the teachings and the message of Islam as a compassionate religion encompassing all schools of thought and in total compliance with the law of the land.  To establish liaison and work with Government, voluntary sector, local authority, statutory bodies, and other agencies.
THE GLOUCESTER MUSLIM WELFARE ASSOCIATION LIMITED	the-gloucester-muslim-welfare-association-limited	GLOUCESTER	GLOUCESTER	GL1 4LY	01452414854		https://www.gmwa.org.uk	0	0	0	1	Muslim Community Welfare,Support, Education, Cultural needs.Offering moral,religious and spiritual guidance.
ISLAMIC CENTRE LEICESTER	islamic-centre-leicester	LEICESTER	LEICESTER	LE2 1DS	01162544459	info@islamiccentre.org	https://www.islamiccentre.org	0	0	0	1	TO PROMOTE THE SPIRITUAL TEACHINGS OF THE ISLAMIC RELIGION AND THE MAINTENANCE OF THE DOCTRINES ON WHICH IT RESTS AND OF THE OBSERVATIONS THAT SERVE TO PROMOTE AND MANIFEST IT ESPECIALLY AMONGST THE MOSLEMS RESIDING IN LEICESTER AND IN THE COUNTY OF LEICESTERSHIRE.
THE ISLAMIC CULTURAL CENTRE ZAKARIYYA JAAM'E MASJID	the-islamic-cultural-centre-zakariyya-jaame-masjid	BOLTON	BOLTON	BL3 5LJ	07878889369	info@zakariyyamasjid.co.uk	https://www.zakariyyamasjid.co.uk	0	0	0	1	Education / TrainingReligious activitiesSport / recreationEnvironment / Conservation / Heritage
MUSLIM STUDENT CHARITY	muslim-student-charity			NW2 4JD	02084524493	info@msconline.org.uk	https://www.msconline.org.uk	0	0	0	1	A) TO RELIEVE NEED AMNG MUSLIM STUDENDS IN THE UNITED KINGDOM. B) TO PROVIDE HOSTELS FOR THE ACCOMODATION OF NEEDY MUSLIM STUDENDS IN THE UNITED KINGDOM. C) TO PROVIDE FACILITIES FOR RECREATION AND LEISURE TIME OCCUPATION IN THE INTERESTS OF SOCIAL WELFARE FOR NEEDY MUSLIM STUDENTS IN THE UNITED KINGDOM
THE BIRMINGHAM MOSQUE TRUST LIMITED	the-birmingham-mosque-trust-limited	HIGHGATE	HIGHGATE	B12 0XS	00441214405355	enquiries@centralmosque.org.uk	https://www.centralmosque.org.uk	0	0	0	1	Daily, Friday and Eid prayers.Family support service for family disputes, divorce, marriage introductions and funeral services.Out of School hours activities Organise educational trips, sport and recreational activities, event study circles, health and fitness activities, classes for martial arts.   Mosque tours and briefings for visitors and Interfaith dialogue and seminars.
OXFORD MOSQUE SOCIETY	oxford-mosque-society			OX4 1AY 	01865247732	jeeptrek@kjti.co.uk	https://156BromleyRoad,Beckenham,Kent.BR36PG	0	0	0	1	Religious Activities
THE ISLAMIC FOUNDATION	the-islamic-foundation	RATBY LANE	RATBY LANE	LE67 9SY	01530244944	info@islamic-foundation.org.uk	https://www.islamic-foundation.org.uk	0	0	0	1	Maintaining an Islamic research library, organising & promoting courses & seminars, making grants to Islamic students, encouraging inter-faith understanding & supporting Islamic centres & mosques.
SOUTH LONDON ISLAMIC CENTRE	south-london-islamic-centre	Streatham	Streatham	SW16 6NN	02086770588	info@slicmosque.org	https://www.slicmosque.org	0	0	0	1	The principal activity of the Charity during the year was the advancement of the religion of Islam andthe education of Muslim children in accordance with the teachings of Quran and Sunnah.Other activities included the relief of poverty, the provision of funeral services to the Muslimcommunity, and the provision of facilities for community development in the South London area.
HOUNSLOW JAMIA MASJID AND ISLAMIC CENTRE	hounslow-jamia-masjid-and-islamic-centre			TW4 5HU	02085700938	gen.secretary@hounslowmasjid.co.uk	https://www.hounslowmasjid.co.uk	0	0	0	1	The Trust's main objective is to promote Islam especially the Sunni Faith, it also provides Funeral services for the community and also educational needs in the Suffah Primary School, which is run by an Educational Committee consisting of four members of the Trust.
CENTRAL JAMIA MASJID SOUTHALL	central-jamia-masjid-southall	SOUTHALL	SOUTHALL	UB2 5PA	02088139218	info@cjmsouthall.co.uk	https://www.cjmsouthall.co.uk	0	0	0	1	Charity provides to the Muslim community (1) organise regular prayers religious social and cultural functions and festival for Muslim community, (2) provide religious education, Holy Quran, the Sunnah & Arabic, English and Urdu, (3) provide burial services to the community, organise school visits & curriculum activities in the Masjid and to develop good relations with non Muslims.
NEWHAM NORTH ISLAMIC ASSOCIATION	newham-north-islamic-association	LONDON	LONDON	E7 8JG	02085868439	greenstreetmasjid@gmail.com	https://www.greenstreetmasjid.org	0	0	0	1	a place for gathering for relegious purposes
THE WALTHAM FOREST ISLAMIC ASSOCIATION	the-waltham-forest-islamic-association	LONDON	LONDON	E10 7EA	02085394282	INFO@WFIA.ORG.UK	https://www.wfia.org.uk	0	0	0	1	Social Service, Mulslim Prayer Gathering, Islamic Education for Children.
ISLAMIC CENTRE EDGWARE	islamic-centre-edgware	R/O 9 Deansbrook Road	R/O 9 Deansbrook Road	HA8 9BE	02087283798	info@islamiccentreedgware.org	https://www.islamiccentreedgware.org	0	0	0	1	To assist local Muslim community with their requirements.
GREENWICH ISLAMIC CENTRE	greenwich-islamic-centre	LONDON	LONDON	SE18 7DW	02088550786	info@gicuk.org	http://www.gicuk.org	0	0	0	1	There was quite a considerable maintenance of the building and services undertaken through out the year. The trend will continue in the coming years.A number of children's and youth activities were carried out during school summer holidays. A Scout Group operated from the Centre, run by dedicated volunteers and supported by other similar Scout Groups.Primarily, a place of worship.
BALHAM MOSQUE	balham-mosque	LONDON	LONDON	SW12 9AW	03003030694	faroukvali@gmail.com	https://www.balhammosque.org	0	0	0	1	The principal activities and objective of the charity is the advancement of religion by conduct of public worship and the religious instruction of person according to the tenets of the religion of Islam.
MUSLIM WELFARE HOUSE	muslim-welfare-house	LONDON	LONDON	N4 2DA  	02072633071	info@mwht.org.uk	https://www.mwht.org.uk	0	0	0	1	REFLECTING THE AIMS OF THE ORGANISATION, THE ACTIVITIES OF MWH INCLUDE- ADULT EDUCATION AND SUPPORT SERVICES - INCLUDING ESOL, IT, CAREERS ADVICE- BUSINESS SUPPORT, TRAINING AND JOB SEARCH ASSISTANCE- RELIGIOUS AND CULTURAL SERVICES - ARABIC CLASSES AND COMMUNITY SOCIAL FORUMS- EDUCATIONAL SUPPORT FOR CHILDREN - MOTHER TONGUE AND SUPPLEMENTARY SCHOOLS
THE MARKAZI JAMIAT AHL-E-HADITH GREAT BRITAIN	the-markazi-jamiat-ahl-e-hadith-great-britain	Small Heath	Small Heath	B9 5DB	01217730019	info@mjah.org.uk	https://www.mjah.org.uk	0	0	0	1	The charity acts as an umberella body for it's affiliated organisations. The charity also publishes a monthly magazine and runs the Islamic Judiciary Board.
WATFORD MOSQUE AND WELFARE ASSOCIATION FOR MUSLIM COMMUNITY	watford-mosque-and-welfare-association-for-muslim-community	WATFORD	WATFORD	WD18 0GJ	01923244567		https://Watfordmosque.org.uk	0	0	0	1	To provide the place of worship for the multi-ethnic community of Muslims in Watford and the surrounding areas.To propogate and expand the teaching and the message of Islam in total compliance with the law of the land.To seek and build better understanding of other faiths and communities through interfaith and multicultural activities.
THE MUSLIM KHOJA SHIA ITHNA-ASHERI COMMUNITY OF PETERBOROUGH	the-muslim-khoja-shia-ithna-asheri-community-of-peterborough			PE1 5HD	01733568592	Secretariat@mksipeterborough.org	https://www.mksipeterborough.org	0	0	0	1	1. To promote the Shia Shariat of the Islamic religion as intepreted by the Shia Ithna-Asheri through the Holy Mujtahid of the Shia Ithna-Asheri both in the city of Peterborough and beyond.
CAMBRIDGE MUSLIM WELFARE SOCIETY	cambridge-muslim-welfare-society			CB1 2DZ	07838400654	abubakrcambridgemosque@gmail.com	https://www.cambridgemosque.com	0	0	0	1	Cambridge Muslim Welfare Society was formed with the purpose of providing a place of worship for Muslims in Cambridge, to provide a platform for interfaith dialogue and congruence; and to provide support to the Muslims as a community in Cambridge.
LEYTONSTONE ISLAMIC ASSOCIATION	leytonstone-islamic-association	9 DACRE ROAD	9 DACRE ROAD	E11 3AG	02085397251	contact@leytonstonemasjid.org.uk	https://leytonstonemasjid.org.uk/	0	0	0	1	We have religious activites for all age groups including people with disabilities.
EXETER MOSQUE AND CULTURAL CENTRE	exeter-mosque-and-cultural-centre			EX4 6PG	01392250597	office@exetermosque.org.uk	https://www.exetermosque.org.uk	0	0	0	1	Charity organisation providing religious activities.
CRAWLEY ISLAMIC CENTRE AND MASJID	crawley-islamic-centre-and-masjid	Langley Green	Langley Green	RH10 9TA	07410308603	admin@crawleymasjid.co.uk	https://crawleymasjid.co.uk	0	0	0	1	Providing Islamic services to the Muslims of Crawley & surrounding areas, promoting welfare and unity. Providing learning opportunites in Islamic studies for adults & children, providing learning opportunities for the non-muslims through our "Dawah" network. Every evening, there is an open lecture in Islamic values/ attributes  followed by Q&A; There is now a female circle, every Saturday 3pm
KINGSTON MUSLIM ASSOCIATION	kingston-muslim-association			KT2 6EJ	07753970000	info@kingstonmosque.org	https://www.KingstonMosque.org	0	0	0	1	Promote understanding of Islam through dialogue and seminars. Arrange prayers five times a day in the mosque. Promote development of spiritual, moral, educational and recreational initiatives for the community. Relieve poverty and hardship in various countries.
ISLAMIC CENTRE ST ALBANS (HERTS)	islamic-centre-st-albans-herts	HERTFORDSHIRE	HERTFORDSHIRE	AL1 4JX	07934 490113	stalbansinc@hotmail.com	http://www.icsta.org.uk	0	0	0	1	(1) OFFER PLACE OF WORSHIP(2) OFFER CLASSES FOR BOYS AND GIRLS(3) LECTURES FOR ADULTS(4) ASSISTANCE WITH FUNERAL SERVICES(5) PROVIDE SPEAKERS AND ACCEPT VISITS FROM SCHOOLS(6) PARTICIPATE IN INTERFAITH DIALOGUE
DARUL AMAAN TRUST	darul-amaan-trust			SW19 1DH	07871360991	info@darulamaanmasjid.org.uk	https://www.darulamaanmasjid.org.uk	0	0	0	1	Running a mosque in south-west London
ISLAMIC CULTURE AND EDUCATION CENTRE BATTERSEA	islamic-culture-and-education-centre-battersea	Battersea	Battersea	SW11 2PF	07898071178	info@icecbattersea.org.uk	https://www.icecbattersea.org.uk	0	0	0	1	MOSQUE AND ISLAMIC YOUTH CENTRE
THE UK TURKISH ISLAMIC TRUST	the-uk-turkish-islamic-trust	LONDON	LONDON	E8 2DA  	02072492244	info@ukturkishislamictrust.co.uk	https://www.ukturkishislamictrust.co.uk	0	0	0	1	Religious & cultural education. Religious prayers/activities. Funeral servicesESTABLISHED SHACKLEWELL COMMUNITY CENTRE HELPING HOMELESS
THAMESDOWN ISLAMIC ASSOCIATION	thamesdown-islamic-association	Swindon	Swindon	SN3 1LX	+447788891699	info@swindonmasjid.com	https://www.swindonmasjid.com	0	0	0	1	The purpose of the charity is to provide a place for worship for the Muslim Community, Educate their children in Islamic teaching and provide bereavement facilities for the Muslim community.  This charity also  provide awareness of Islam to various local and county schools, local borough and police department. This activities are provided within Wiltshire.
JAMME MASJID, READING	jamme-masjid-reading	BERKSHIRE	BERKSHIRE	RG1 5PF 	01189261565		https://www.readingmosque.org.uk	0	0	0	1	THE ADVANCEMENT OF THE RELIGION OF ISLAM IN ACCORDANCE WITH THE TEACHINGS OF THE HOLY QUR'AN AND THE ADVANCEMENT OF THE EDUCATION OF THE MUSLIM COMMUNITY IN READING AND ITS SURROUNDING AREAS.
GRAVESEND AND DARTFORD MUSLIM ASSOCIATION	gravesend-and-dartford-muslim-association	11 ALBION TERRACE	11 ALBION TERRACE	DA12 2SX	01474323092	gravesendmosque@outlook.com	https://gravesendmosque.com	0	0	0	1	We serve as a mosque for the Muslim community. We also act as a centre for inter-faith education. Additionally, we provide facilities for the Islamic education of children and young people. We help to collect funds for various charity organisations. We work closely with Gravesham Borough Council and the police to increase their awareness of Islam. We provide regular outings and organised events.
MASJID-E-ALI (A.S)	masjid-e-ali-a-s	LUTON	LUTON	LU4 8RP	07833250207	info@masjideali.org	https://www.masjideali.org	0	0	0	1	THE TRUSTEES SHALL HOLD THE TRUST FUND AND ITS INCOME TRUST TO APPLYTHEM FOR THE FOLLOWING OBJECTS IN UK 1. THE ADVANCEMENT OF RELIGION OF ISLAM 2. THE ADVANCEMENT OF EDUCATIONOF ISLAM TO MUSLIMS & NON-MUSLIMS 3. OTHER CHARITABLE PURPOSES FOR THEBENEFIT OF THE COMMUNITY.
UNITED KINGDOM TURKISH ISLAMIC ASSOCIATION	united-kingdom-turkish-islamic-association			N16 8BU 	02072540046	enquiries@aziziye.org.uk	https://www.aziziye.org.uk	0	0	0	1	To provide a place to worship and facilities for education and religious studies for Muslims.It also endeavours to help those in need.
THE WORLD FEDERATION OF KHOJA SHIA ITHNA-ASHERI MUSLIM COMMUNITIES	the-world-federation-of-khoja-shia-ithna-asheri-muslim-communities	STANMORE	STANMORE	HA7 4LQ	02089549881	secretariat@world-federation.org	https://www.world-federation.org	0	0	0	1	The World Federation of KSIMC provides these activities through its Regional Federations and partners based internationally In America, Europe, Africa, Pakistan, India and Australia.
ISLAHUL MUSLIMEEN	islahul-muslimeen			NN8 1JD 	07762125255	islahulmuslimeen@hotmail.co.uk	https://WWW.WELLINGBOROUGHMOSQUE.CO.UK	0	0	0	1	MOSQUE AND COMMUNITY CENTRE WELLINGBOROUGHSOCIAL CULTURAL SPORTS AND RECREATIONAL ACTIVITIES. LANGUAGE CLASSES. RELIGIOUS STUDIES.
JAMIAT-UL-MUSLEMEEN QUWAT-UL-ISLAM MASJED	jamiat-ul-muslemeen-quwat-ul-islam-masjed	Broadfield	Broadfield	RH11 9SE	01293 553070	info@crawleymosque.com	https://www.crawleymosque.com	0	0	0	1	1. To provide facilities for the daily, Friday and festival prayers2. The establishment of an Islamic Centre3. The provision of facilities for the practice of the Islamic faith4. The facilitation of communal activities5. The provision and facilitation of Islamic education
CROYDON MOSQUE AND ISLAMIC CENTRE	croydon-mosque-and-islamic-centre			CR7 6AR 	02086848200	enquiries@croydonmosque.com	https://www.croydonmosque.com	0	0	0	1	Advancement of the religion of Islam and the education of Muslim children in accordance with the teaching of Quran and Sunnah.
INTERNATIONAL MUSLIM MOVEMENT	international-muslim-movement			E17 9NG	02085214121	info@dqj.org.uk	https://www.dqj.org.uk	0	0	0	1	Religious and educational activities to bring about good relationship and harmony by introducing true picture of Islam.
WEMBLEY CENTRAL MASJID	wembley-central-masjid	Middlesex	Middlesex	HA0 4AE	07939239238	wembleycentralmasjid@gmail.com	https://www.wembleycentralmasjid.co.uk	0	0	0	1	Religious activities including five daily prayers, the friday prayer, Eid prayers and other religious activities on special islamic days. Classes in urdu and arabic languages for children, including quaranic studies.
SEVEN KINGS MUSLIM EDUCATIONAL TRUST	seven-kings-muslim-educational-trust	Seven Kings	Seven Kings	IG3 8RG	07973129914	info@skmet.co.uk	https://www.skmet.co.uk	0	0	0	1	Islamic Education,donations and rental income
THE UNITED KINGDOM TURKISH ISLAMIC CULTURAL CENTRE	the-united-kingdom-turkish-islamic-cultural-centre			E2 8AX	02076849900	info@suleymaniye.org	https://www.suleymaniye.org	0	0	0	1	Advancement of Islam and education, the protection of health, the relief of poverty, sickness, distress and all related needs amongst the Muslim Community
INSTITUTE OF MUSLIM MINORITY AFFAIRS	institute-of-muslim-minority-affairs			W1T 4LU	02076366740	imma_hi@yahoo.co.uk	https://www.imma.org.uk	0	0	0	1	Purpose of the institute is advancement of education and promoting research on conditions and way of life. History and development of muslim minority communities throughout the world and compile information and statistics in relation thereto and publish useful result of such study and research and dessiminate such information through their quarterly journal relating to life and condition of muslim
THE KHOJA SHIA ITHNAASHERI MUSLIM COMMUNITY OF LONDON	the-khoja-shia-ithnaasheri-muslim-community-of-london	STANMORE	STANMORE	HA7 4LQ	02089546247	admin@hujjat.org	https://www.hujjat.org	0	0	0	1	The objects for which the Charity has been established is to promote and advance the Islamic Religion in accordance with the principles of the Shia Ithna-Asheri Sharia and to provide for the relief of poverty among Muslims of the Shia Ithna-Asheri faith.
BASINGSTOKE MUSLIM WELFARE ASSOCIATION	basingstoke-muslim-welfare-association	Hampshire	Hampshire	RG24 9TT	07835320876	younus.ali@gmail.com	https://www.bmwa.uk	0	0	0	1	PLACE OF WORSHIP, SOCIAL ACTIVITIES, EDUCATION, SPORTS, YOUTH ACTIVITIES, HEALTH RAISE AWARENESS AMONG MUSLIMS OF ISSUES RELATED TO DRUGS AND INFECTIOUS DISEASES, BIRTH & DEATH RELATED ISSUES, PROVIDE COMMUNICATION LINK WITH HEALTH ORGANISATION RAISE AWARENESS OF MUSLIMS ISSUES. MATRIMONIAL PROVIDE COUNSELLING AND SUPPORT FOR MARRIAGE AND DIVORCE ISSUES
GHAUSIA COMMITTEE AYLESBURY (AYLESBURY MOSQUE)	ghausia-committee-aylesbury-aylesbury-mosque	AYLESBURY	AYLESBURY	HP20 2NX	01296398446	secretary@aylesburymosque.org	https://www.aylesburymosque.org	0	0	0	1	The charity has continued to meet its main objectives of establishing, maintaining and managing Aylesbury Mosque for the prayers of Muslim inhabitants of Aylesbury and the neighbouring areas within Aylesbury Vale.
MUSLIM CULTURAL SOCIETY OF THE UNITED KINGDOM	muslim-cultural-society-of-the-united-kingdom			N16 7NX	02072540967	info@masjidtarbiyah.org	https://www.masjidtarbiyah.org	0	0	0	1	The committee members attended family matters, visiting the sick and elderly and bereaved families. Ladies group meet once a month. Functions held for members at large. Provide religious education to children and families on a weekly and monthly basis. Distribution of free news letters and calendars to members.
HENDON MOSQUE & ISLAMIC CENTRE	hendon-mosque-islamic-centre	LONDON	LONDON	NW9 7EL	02082023236	hendonmosque@hotmail.com	https://www.hendonmosque.org	0	0	0	1	Place of worship and centre for Islamic studies
THE INDIAN MUSLIM RELIEF COMMITTEE	the-indian-muslim-relief-committee			NW2 1BX	0800 3281408	muftibarkatullah@gmail.com	https://www.imrc.org.uk	0	0	0	1	Educational and religious
NEWHAM MUSLIM CITIZENS ASSOCIATION	newham-muslim-citizens-association			E6 1EW	020 7101 9432		https://www.n-m-c-a.org	0	0	0	1	Operating to provide affordable legal advice services and community cohesion projects in England and Wales.
WEST LONDON ISLAMIC CENTRE	west-london-islamic-centre	412 Greenford Road	412 Greenford Road	UB6 9AH	07939251366	info@wlicgreenfordmosque.com	https://www.wlicgreenfordmosque.com	0	0	0	1	PROVIDING PRAYING AREA/FACILITIES TO MUSLIMS ON A DAILY BASIS ESPECIALLY EID DAYS AND FRIDAYS.CONDUCTING QURANIC CLASSES TO HELP MUSLIMS READ THE QURAN.CONDUCTING CLASSES TO EDUCATE MUSLIMS ON OTHER ISLAMIC MATTERS.
MADINA MOSQUE TRUST	madina-mosque-trust	LONDON	LONDON	E5 9QD  	02089858204	info@madina-masjid.org.uk	https://WWW.MADINA-MASJID.ORG.UK	0	0	0	1	Promoting, advancing and maintaining religious activities
ACTON MUSLIM WELFARE ASSOCIATION	acton-muslim-welfare-association	LONDON	LONDON	W3 6LS	02089938073	aizad.hussain@actonmosque.org	https://www.actonmosque.org	0	0	0	1	Acton's main mosque providing daily prayers, pastoral care and religious teaching.
MUSLIM CULTURAL AND WELFARE ASSOCIATION OF SUTTON	muslim-cultural-and-welfare-association-of-sutton			SM5 3DH	02086698290	email@mcwas.org	https://www.mcwas.org	0	0	0	1	Islamic Arts and Crafts exhibitions,Christmas Parties,Daily 5 times Prayers,Holocaust Remembrance Event,Street Party,Children's Activities and Parties,Musical recitals and interfaith Meetings.
THE LEAGUE OF BRITISH MUSLIMS - UK	the-league-of-british-muslims-uk	ILFORD	ILFORD	IG1 2UE	02085140706	leagueofbm@btconnect.com	https://www.leagueofbritishmuslims.co.uk	0	0	0	1	The League of British Muslims on a local and national level. Locally, we provide after school facilities, religious education, indoor sports facilities, pre-school children's services, services for frail & elderly people, office accommodation, prayer facilities, and social and cultural activities. On a nationally level, the League conducts research affecting Muslims and impacts on national policy.
ISLAMIC EDUCATION AND CULTURAL SOCIETY	islamic-education-and-cultural-society			UB3 3NB	0208 561 7149	info@hayesmuslimcentre.org.uk	https://hayesmuslimcentre.org.uk	0	0	0	1	Providing religious and  educational facilities. Organising Seminars, also social and religious functions.
THE SHIA ISLAMIC EDUCATION SOCIETY	the-shia-islamic-education-society			SW16 5HU	02082410222	rizvi1933@yahoo.co.uk	https://www.sies.co.uk	0	0	0	1	The Shia Islamic Education Society has been set up to promote and advance the islamic religion in accordance with the principles of the Shia Ithna-Asheri faith and for the relief of the poor belonging to the Shia sect. The managing trustee can raise funds for the upkeep, restoration and repair of the buildings used for this purpose and to provide other services to meet these objectives.
AL-HUDA CULTURAL CENTRE & MOSQUE	al-huda-cultural-centre-mosque	LONDON	LONDON	E1 4UJ	02077809495	Info@alhudamosque.com	https://www.alhudamosque.com	0	0	0	1	Activitiesa. Educational & Cultural Workshopsb. Advice, Advocacy, Information on immigration, housing, benefits, hospitals. c. Family affairs such as marriage, mediation, counselling & Women affairs, d. Substance misuse advice and guidance.e. elderly advice and support & youth work f. Islamic propagation:-five time a day prayers, Ramadan (evening meal) program,
THE ILFORD MUSLIM SOCIETY	the-ilford-muslim-society	ESSEX	ESSEX	IG1 4JE	02084780347	info@ilfordmuslimsociety.org	https://www.ilfordmuslimsociety.org	0	0	0	1	Education/training, religious activities. Relief of poverty etc.
THE OXFORD CENTRE FOR  ISLAMIC STUDIES	the-oxford-centre-for-islamic-studies	OXFORD	OXFORD	OX3 0EE 	01865278731	islamic.studies@oxcis.ac.uk	https://www.oxcis.ac.uk	0	0	0	1	The principal activites of the charity are dedicated to the encouragement by academic means of a more informed understanding of the culture and civilization of Islam and of contemporary Muslim societies.  For these purposes the Centre is committed to the promotion of scholarship, teaching, research, publication and dialogue and co-operation in the world of learning.
COLCHESTER ISLAMIC CULTURAL ASSOCIATION	colchester-islamic-cultural-association	COLCHESTER	COLCHESTER	CO1 2PY	01206700872	info@colchestermosque.co.uk	https://www.colchestermosque.co.uk	0	0	0	1	Provision of mosque and associated facilities for residents of Colchester and nearby towns/villages as well as visitors to this area, in addition to educational classes, events and meetings for general public.
ABRAR ISLAMIC FOUNDATION	abrar-islamic-foundation			W1H 4LP	02077243033	abrarhouse@hotmail.com	https://www.abraronline.net	0	0	0	1	Establishing an information and research centre or information devoted to the study and dissemination of Muslim Shia Ithna-Ashari thought and educational needs of Muslims in the United Kingdom
THE SOUTH INDIAN MUSLIM WELFARE ASSOCIATION (UK)	the-south-indian-muslim-welfare-association-uk			CR0 3QQ	02086894486	info@simwa.org.uk	https://www.simwa.org.uk	0	0	0	1	The charity represents and provide social and welfare assistance to the South Indian Muslims in the UK. Most of its members live in and around Croydon, south London.
JAMIA AL-KARAM (ISLAMIC EDUCATIONAL AND CULTURAL TRUST)	jamia-al-karam-islamic-educational-and-cultural-trust	RETFORD	RETFORD	DN22 0PR	01777706441	info@alkaram.org	https://www.alkaram.org	0	0	0	1	Provision of Islamic education to Muslim children and to prepare Muslim scholars, and the promotion of Islamic culture and needs in all forms.
KSI MUSLIM COMMUNITY OF MILTON KEYNES	ksi-muslim-community-of-milton-keynes	Bletchley	Bletchley	MK1 1NW	07919874010	secretariat@ksimk.org	http://ksimiltonkeynes.org/	0	0	0	1	The charity's objects are the propagation and promotion of the spiritual, educational and humanitahan teachingsof the Shia ithna-asheri Muslim Faith.
GHANA MUSLIM UNION	ghana-muslim-union			HA2 8RR	07970485295		https://www.gmuuk.org	0	0	0	1	TEACHING GHANAIAN AND ISLAMIC LESSONS AND HOLDING SOCIAL GATHERING FOR THE YOUTH AND ALL GHANAIAN MOSLEMS
MADINA ISLAMIC MISSION AND ISLAMIC CENTRE HEATHROW	madina-islamic-mission-and-islamic-centre-heathrow	MIDDLESEX	MIDDLESEX	TW3 3RN	07956397666	madinaislamicmission@gmail.com	http://www.madinaislamicmission.co.uk/	0	0	0	1	Children care and education ? stop due to lack of space?Eid Melas, Parties (prophets birthdays) celebrating with the Muslimsociety and other cultures, sell and buy Asian culture gifts?Poets evening for talented people who want to express their artisticwork this is for all culture and religions?Hold competitions for the young members of our society to get moreinvolved(off the streets)
JAMME MASJID GHAUSIA - READING ISLAMIC CENTRE (ANJUMAN MUHIBBAN-E-RASOOL, READING)	jamme-masjid-ghausia-reading-islamic-centre-anjuman-muhibban-e-rasool-reading			RG1 4RA 	01189504756	info@ricuk.org	https://www.ricuk.org	0	0	0	1	Reading Islamic Centre provides a place of prayer and congregation for the Muslim community of Reading open to all men, women and children and elderly, and includes wedding and funeral services in accordance with the Islamic faith. Also it provides educational classes for both children and adults who are seeking to learn about Islam.
