name	slug	address	city	postcode	phone	email	website	capacity	has_women_section	has_parking	has_wudu	description
AHMADIYYA MUSLIM JAMAAT INTERNATIONAL	ahmadiyya-muslim-jamaat-international			SW19 3TL	02085447602	saf@amjinternational.org	https://www.amjinternational.org	0	0	0	1	Our activities are as follows:- the propagation of Islam worldwide;- the building of mosques, hospitals and schools;- scientific research and development;- the award of scholarships for higher education;- the provision of emergency relief in cases of natural disasters; and- assistance to the deserving and needy.
BEESTON MUSLIM CENTRE	beeston-muslim-centre	NOTTINGHAM	NOTTINGHAM	NG9 2EU	0115 9346370	info@beestonmuslimcentre.co.uk	https://www.beestonmuslimcentre.co.uk	0	0	0	1	Education supportPrayers ProvisionYouth ForumHealth Advice
ASSOCIATION OF MUSLIM SCHOOLS UK	association-of-muslim-schools-uk	Luton	Luton	LU3 1RJ	01212850710	admin@ams-uk.org	https://www.ams-uk.org	0	0	0	1	PROVIDE TRAINING AND ASSIST SCHOOLS.
MADRASATUNNUR EDUCATIONAL TRUST	madrasatunnur-educational-trust			UB2 5UH	02088936151	madrasatunnur.educational@gmail.com	https://www.madrasatunnur.org	0	0	0	1	Provide Islamic Education for Children and Adult as whole
JAMIA MASJID & MADRASSA FAIZ UL QURAN GHOUSIA	jamia-masjid-madrassa-faiz-ul-quran-ghousia	Birmingham	Birmingham	B33 8UB	07968794080	mr.yasin@aol.co.uk	https://stechfordmosque.org.co.uk	0	0	0	1	The principal object of the charity is to provide a place of worship, religious teachings and education centre for the benefit of the local community.
MUSLIM RELIEF	muslim-relief	BATLEY	BATLEY	WF17 6LB	01924465550	mail@muslimrelief.org.uk	https://muslimrelief.org.uk	0	0	0	1	Muslim Relief conducts many charitable projects globally. These range from community projects, supporting homeless persons, providing emergency food & shelter, medical aid, organising mass feedings, supporting orphans & widows, educational advancement, water relief, promoting community cohesion, social youth work, raising awareness pertaining to issues relating to the youth & vulnerable persons.
INDONESIAN ISLAMIC CENTRE	indonesian-islamic-centre			SE9 3BG	07761152510	djalil11@yahoo.co.uk	http://iic-london.com	0	0	0	1	Organising social gatherings for Indonesian Muslim Community, organising sport & arts & cultural events, ocassionally organising fund raising to support people in need or victims of natural disasters, providing information about the religion of islam and muslim, and participating in interfaith events (dialogues).
AL-JAMIA DARUL QURAN BOLTON UK	al-jamia-darul-quran-bolton-uk			BL3 6TJ 	01204659099	SECRETARY@DARULQURANBOLTON.CO.UK	https://WWW.DARULQURANBOLTON.CO.UK	0	0	0	1	PROVIDING PRAYER FACILITIES FOR THE RUMWORTH AREA BOLTONPROVIDES ISLAMIC EDUCATION TO YOUNG CHILDREN
JAMIA MOSQUE ANWAR-UL-LOOM TRUST	jamia-mosque-anwar-ul-loom-trust	SMETHWICK	SMETHWICK	B66 3EU	01216016721	info@smethwickjamiamosque.co.uk	https://www.smethwickjamiamosque.co.uk	0	0	0	1	Charitys provides following activities, evening and weeekend classes for children education in arabic and urdu language, holds special gathering for islamic calender days.etc
SMETHWICK PAKISTANI MUSLIMS ASSOCIATION LTD	smethwick-pakistani-muslims-association-ltd	Suffrage Street	Suffrage Street	B66 3PZ	01215556047	info@spmaltd.org.uk	https://www.spmaltd.org.uk	0	0	0	1	We provide advocacy, education / training, health activities, exercise classes for the residents of Sandwell.
SWANSEA MOSQUE AND ISLAMIC COMMUNITY CENTRE	swansea-mosque-and-islamic-community-centre			SA1 4DQ 	01792654532	info@swanseamosque.org	https://www.swanseamosque.org	0	0	0	1	To serve and benefit not only the local congregation but humanity in line with teachings of Quran and sunnah of the last Prophet (pbuh) through interfaith and intercommunity dialogue, relief of poverty, youth activites, educational services, environmental awareness and the general promotion of peace, love, mutual understanding and harmony across society irrelevant of sex, race, religion or creed.
IPSWICH AND SUFFOLK BANGLADESHI MUSLIM COMMUNITY CENTRE AND MOSQUE	ipswich-and-suffolk-bangladeshi-muslim-community-centre-and-mosque	IPSWICH	IPSWICH	IP3 8LF	01473716650	info@ipswichmosque.org	https://www.ipswichmosque.org	0	0	0	1	The objectives of the company are:To provide facilities in the interest of the social welfare;To relieve the beneficiaries in need;To relieve unemployment for the beneficiaries;To advance education of the beneficiaries in the area of benefit;To advance Muslim religion;To relieve Muslims in Suffolk who are aged, disabled, suffering from financial hardship or who are otherwise in need.
MUSLIM HANDS	muslim-hands	NOTTINGHAM	NOTTINGHAM	NG7 5JE	004401159117222	contact@muslimhands.org.uk	https://www.muslimhands.org.uk	0	0	0	1	International relief organisation fundraising in the UK and distributing those funds to educational and humanitarian projects worldwide.
LEEDS NEW MUSLIM PROJECT	leeds-new-muslim-project	LEEDS	LEEDS	LS14 2EX	07917061808		https://www.leedsnewmuslims.org.uk	0	0	0	1	personal support/advice, social gatherings, study circles, provision of books/cd's, youth activities
MUSIDAL ISLAMIC ASSOCIATION UK	musidal-islamic-association-uk	LONDON	LONDON	E1 7RA  	447903877386		https://www.musidal.org.uk	0	0	0	1	FOR THE ACCOMPLISHMENT OF ADVANCEMENT IN ISLAMIC FAITH AS CONTAINED IN THE HOLY QURAN, HADITH AND ISLAMIC SHARIAH, AS WELL AS PROMOTING CHARITABLE ACTIVITIES TO THE MUSLIM COMMUNITY, PARTICULARLY WEST AFRICAN MUSLIMS IN UNITED KINGDOM SO AS TO REDUCE POVERTY AND DISTRESS
BRIXTON HILL ISLAMIC CENTRE	brixton-hill-islamic-centre	LONDON	LONDON	SW2 1HE 	020335839729	info@bhic.org.uk	https://bhic.org.uk	0	0	0	1	The advancement of education among Muslim community in  UK through the provision of Islamic culture & heritage, supplementary classes.The relief of poverty, sickness and stress by promoting culture & identity.To identify issues of common concern to women,Children and Young adult in the areas of health, education,personal development. To relief of poverty, sickness Banadir regions of Somalia
MASJID AL AQSA	masjid-al-aqsa	BOLTON	BOLTON	BL1 4LL	01204771918	aqsaeducation@gmail.com	https://www.masjid-e-eaqsa.org	0	0	0	1	To provide Islamic religious education, prayer facilities and organise functions to  Muslims in accordance with the Sunni Hanafi Barelvi school of thought.
KUTCHI MUSLIM ASSOCIATION	kutchi-muslim-association			SO14 0ES	07428697276	ksumra@hotmail.com	https://www.jumahpay.app	0	0	0	1	WOMENS MEETINGSDAYS OUTFESTIVALS CLEBRATIONS
OADBY AND WIGSTON MUSLIM ASSOCIATION	oadby-and-wigston-muslim-association	Sandhurst Street	Sandhurst Street	Leiceste	01162714786	INFO@OWMA.ORG.UK	https://www.owma.org.uk	0	0	0	1	To serve as center of learning and to teach the principals of the Islamic Faith in accordance with the Sunni path.To guide Muslims in Islamic Faith.To actively promote and provide facilities and activities for the benefit of the local Muslim Men and women, young and elderly.To promote racial and religious harmony by engaging with local indigenous community.
KETTERING MUSLIM ASSOCIATION	kettering-muslim-association			NN15 6AD	0754900288	chairman@ketteringmuslim.co.uk	https://www.ketteringmuslim.co.uk	0	0	0	1	To provide charitable, educational, community and religious services for the Muslims living in the Kettering Borough
BOLTON COUNCIL OF MOSQUES	bolton-council-of-mosques	BOLTON	BOLTON	BL3 5LE 	07877445047	admin@thebcom.org	https://www.thebcom.org	0	0	0	1	The advancement of the Islamic religion by encouraging the establishing and maintenance of Mosques. The promotion of racial and religious harmony between Muslims and non-Muslims in order to foster mutual understanding and toleration. The promotion of such other charitable purposes particular for the benefit of the Muslim Community as the trustees think fit.
SLOUGH WEEKEND ISLAMIC SCHOOL	slough-weekend-islamic-school			SL1 1RS	07967483661	info@swis.org.uk	https://www.swis.org.uk	0	0	0	1	To give our children a good basic understanding of Islam & to develop confidence & identity in being a MuslimTo provide creative, recreational & cultural activities to children, including arts/crafts, music, sporting activities and day tripsTo instill qualities/behaviour expected in a culturally rich, diverse communityTo take pride in our local community & raise funds for local causes
MUSLIM YOUTH HELPLINE	muslim-youth-helpline	LONDON	LONDON	E16 2DQ	0808 808 2008	info@myh.org.uk	https://www.myh.org.uk	0	0	0	1	Our core service is a free and confidential emotional support service service available nationally via the telephone, email, web chat and letter. The service uses male and female volunteers trained in basic counselling skills to respond to client enquiries.
BRITISH MUSLIM HERITAGE CENTRE	british-muslim-heritage-centre	MANCHESTER	MANCHESTER	M16 8BP	01618818062	finance@bmhc.org.uk	https://www.bmhc.org.uk	0	0	0	1	The Centre aims to provide diverse facilities for people in UK and abroad. Facilities will include social, economic, community cohesion and development. Provisions for education, training, and exhibitions will also be made available. The Centre is predicted to fulfil a variety of social and economic functions and to assist in the affirmation of cultural identity and plurality.
THE KATHOR MUSLIM SOCIETY OF UK	the-kathor-muslim-society-of-uk			E17 6RS	02089235588	info@kathormuslimsociety.org.uk	https://www.kathormuslimsociety.org.uk	0	0	0	1	The society's main activities fall into 3 main areas; Medical assistance; Education; Most Needy/Social welfare.  We have sponsored early diagnosis and preventative Health Camps covering dentistry, family/women's health, orthopaedics and cardiology.  We support undergraduate students to complete their higher education, and  have many projects on social welfare.
EDGWARE MUSLIM COMMUNITY CENTRE	edgware-muslim-community-centre	MIDDLESEX	MIDDLESEX	HA8 7EQ 	07958336267	emcc48@yahoo.com	https://www.edgwarecentralmosque.org	0	0	0	1	Religious Activities in Barnet, Brent and Harrow Area.Provider of religious Education in Barnet, Brent and Harrow Area.
THE SHROPSHIRE ISLAMIC FOUNDATION	the-shropshire-islamic-foundation	Wellington	Wellington	TF1 1NZ	07814611332	info@sifuk.org	https://www.sifuk.org	0	0	0	1	The Shropshire Islamic Foundation (SIF) provides Islamic education & community prayer facilities to the people of Telford and the surrounding areas. Premises include Telford Central Mosque, King St, and Tan Bank Mosque,  both in Wellington. Services includes a boys & girls evening school, various weekend social and community events mainly via Shropshire and Telford United Women's Association.
BEXHILL ISLAMIC ASSOCIATION	bexhill-islamic-association			TN40 1QA	01424211977	info@bmic.org.uk	https://www.bmic.org.uk	0	0	0	1	(a)Provide facilities for congregational prayers for men and women(b)Provide and maintain a Mosque & Community Centre (c)Maintain a library(d)Provide funeral services & organise Eid festivals, marriage & other ceremonies(e)Co-operate with other organisations(f)Arrange lectures, meetings and seminars(g)Promote facilities for in advancement of education and leisure time activities
SHEFFIELD ISLAMIC CENTRE MADINA MASJID TRUST	sheffield-islamic-centre-madina-masjid-trust			S8 0ZU	01142585021	admin@madinamasjid.org.uk	https://www.madinamasjid.org.uk	0	0	0	1	The chairty activites at present are as follows - (1) provide and maintain a school for general Islamic educaution of children; (2) facilities for eduaction of adults; (3) facilities and services for congregational prayers for men, women and children and; (3) developing social and welfare service for the elderly.
ASSOCIATION OF SENIOR MUSLIM CITIZENS	association-of-senior-muslim-citizens	Middlesex	Middlesex	HA2 7HT	07966156051	asmc-harrow@hotmail.com	https://www.asmc.org.uk	0	0	0	1	Continue and consolidate efforts towards relief of poverty, improving quality of life of the elderly residents by (1) Home/social and hospital visits together with liaison with their families while in hospital. (2) Organising seminars/talks, presentation, social get together and minimise isolation with emphasis on health and safety. (3) Ensuring improvement in health awareness, safety, reducing is
MALAYALEE MUSLIM CULTURAL AND WELFARE ASSOCIATION (UK)	malayalee-muslim-cultural-and-welfare-association-uk	NORTHOLT	NORTHOLT	UB5 4NL	07876281283	mmcwauk@gmail.com	https://www.mmcwa.com	0	0	0	1	MMCWA aim for advancement of education in Malayalam language and to provide  social and cultural support to the community, giving special attention to the needs of youngsters who needed guidance and support to understand their cultural roots at the same time integrating well into the social structure of Great Britain. MMCWA also undertakes various relief works to help the needy.
MADINA MOSQUE AND COMMUNITY CENTRE	madina-mosque-and-community-centre	CARDIFF	CARDIFF	CF244NZ 	02920224499	INFO@MADINAMOSQUECARDIFF.CO.UK	https://www.madinamosquecardiff.co.uk	0	0	0	1	To advance the religion of Islam for the benefit of the public by holding congregational  5 daily prayers and Friday prayers and religious lectures. To provide facilities for Islamic education & community activities for childern and adults and pastoral care. The provision of funeral services and congressional funeral prayers for the deceased and their families and the wider community.
SRI LANKA MUSLIM ASSOCIATION (UK)	sri-lanka-muslim-association-uk	BERKSHIRE	BERKSHIRE	SL2 5AH 	01753315618	sloughaljannah@gmail.com	https://www.aljannah.org.uk	0	0	0	1	WORKING MAINLY WITH THE SRI LANKAN COMMUNITY LIVING IN  SLOUGH AREA TO IMPROVE AND INTEGRATE OUR COMMUNITY WITH THE HOST COMMUNITY.PROVIDING THE FACILITIES TO MEET   SOCIO, CULTURAL AND RELIGIOUS REQUIREMENTS OF THE LOCAL MUSLIM COMMUNITY. FOR THIS PURPOSE WE HAVE ESTABLISHED MASJID AL-JANNAH: ISLAMIC EDUCATIONAL & COMMUNITY CENTRE AT 1, STOKE ROAD SLOUGH BERKSHIRE SL25AH,  SINCE MARCH 2014.  
MORDEN ISLAMIC CENTRE	morden-islamic-centre	SURREY	SURREY	SM45AX  	02085400302	admin1@miconline.co.uk	https://www.miconline.co.uk	0	0	0	1	Educational activities:Quran & Arabic classes Evening Islamic educational classesCharacter building lessons through the Quran and HadithFriday educational sermon Ladies lecture seriesIslamic services:Five daily prayersFriday prayersEid prayersWedding ceremoniesCounselling Youth Club (recreational facilities, pool table)Food Relief Bank Gym FacilitiesSocial Events
INDIAN MUSLIM TRUST	indian-muslim-trust	WALTHAM FOREST	WALTHAM FOREST	E11 4RP	0203 793 0403	imt@indianmuslim.org.uk	https://www.indianmuslim.org.uk	0	0	0	1	Social Cultural Activities.
NEWCASTLE CENTRAL MOSQUE MASJID AL-TAWHID	newcastle-central-mosque-masjid-al-tawhid	NEWCASTLE UPON TYNE	NEWCASTLE UPON TYNE	NE4 8RQ	01912730262	CONTACT@NEWCASTLECENTRALMOSQUE.COM	https://www.newcastlecentralmosque.com	0	0	0	1	The charity inter-acted with the local Muslim community seeking volunteers and garnering donations.The Charity has held regular prayer meeting as well as lectures.
KENT MUSLIM WELFARE ASSOCIATION LIMITED	kent-muslim-welfare-association-limited	Kent	Kent	ME7 5UH	01634850878	info@kmwa.org.uk	https://www.kmwa.org.uk	0	0	0	1	The KMWA has become a source of support and knowledge to its diverse Muslim community, as well as an enriching initiative to help serve the wider host community and strenghten community cohesion.
THE CHRISTIAN MUSLIM FORUM	the-christian-muslim-forum			N1 9JP  	02078325841	info@christianmuslimforum.org	https://www.christianmuslimforum.org	0	0	0	1	Forum for Christian Muslim relations. Opportunities for a broad range of Christians and Muslims to meet and understand each other, developing models of disagreeing well and enabling participants to interpret experiences back to their own communities. Activities include church-mosque twinning, discussion of controversial topics, public events and the production of useful resources.
ANATOLIAN MUSLIMS SOCIETY	anatolian-muslims-society	London	London		020 8884 2737	info@rumimosque.uk	https://www.rumicentre.org.uk	0	0	0	1	We organise a number of activities and provide services to advance and promote inter-cultural, inter-faith and inter-communal dialogue, understanding and appreciation in the UK. We do this by organising talks, knowledge & skills based courses and cultural events in order to help advance social awareness, education and integration within our local community.
WARRINGTON ISLAMIC ASSOCIATION	warrington-islamic-association	Bewsey	Bewsey	WA5 0BF	07814037411	info@warringtonislamicassociation.org.uk	https://www.warringtonislamicassociation.org.uk	0	0	0	1	To advance education and to provide facilities in the interests of social welfare, for recreation and leisure time occupation, with the object of improving conditions of life for persons in the Warrington area. Promote equality and diversity by working towards the elimination of racial discrimination and promote good relations between persons of different racial groups in the Warrington area.
THE SHAH JALAL ISLAMIC FOUNDATION	the-shah-jalal-islamic-foundation	SUTTON	SUTTON	SM1 4LF	01737362648	nurul.islam@sky.com	https://www.suttonmuslimcentre.org.uk	0	0	0	1	Education/TrainingReligious activitiesArts/cultureEconomic/Community development/Employment
MARKAZ MUAADH IBN JABAL ISLAMIC CENTRE	markaz-muaadh-ibn-jabal-islamic-centre			SL1 2SA	01753533376	info@markazmuaadh.com	https://www.markazmuaadh.com	0	0	0	1	Advance the Islamic religion for the benefit of the public through holding prayers, lectures, holding regular classes for Muslim children, producing and/or distributing literature on Islaam to enlighten others about Islam.Collect the yearly Zakat and distribute to those eligible from amongst the community and those outside the community but known to members of the congregation.
UGANDA MUSLIM COMMUNITY IN UNITED KINGDOM	uganda-muslim-community-in-united-kingdom	London	London	E7 8NH	07496857040	kasaatorashid@yahoo.com	https://umcuk.org	0	0	0	1	The primary activity is to bring together Muslims  from Black African Communities to hold prayers and celebrate religious festivals as a community. It also supports members to address issues of concern like social exclusion, community cohesion, employment, and other social economic issues linked with immigrant communities, through support groups, workshops, seminars, training & pastoral care.
Muslim Association for Spirituality and Engagement	muslim-association-for-spirituality-and-engagement			W3 7NQ	07592241958	admin@mase-uk.co.uk	https://Https://Mase-uk.co.uk	0	0	0	1	We help to serve the Muslim community in particular and to helped to build bridges of understanding and mutual respect across faith communities. To advance and promote tolerance and integration within British communities.
MARKAZ-AL-HUDA LTD	markaz-al-huda-ltd			BL9 7AF	0161 221 9872	project-29@hotmail.co.uk	https://www.project29.org.uk	0	0	0	1	Activities; General charitable purposes, Education / Training, empower local communities, Eradicate Religious and cultural prejudices. promote voluntary involvement 4 youth training in media,production, broadcast, on all platforms globally on various social media apps. and on www.salaambcr.com 24/7, training 4 employment, engage with voluntary groupsand local authorities, promote gender equality.
AL-MEDINA ISLAMIC CENTRE	al-medina-islamic-centre	ACCOKS GREEN	ACCOKS GREEN	B27 6PX 	01217064690		https://WWW.ALMADINAISLAMICCENTER.CO.UK	0	0	0	1	My charity's current activities are fundraising.
OMAR FARUQUE MOSQUE AND CULTURAL CENTRE	omar-faruque-mosque-and-cultural-centre			CB4 2ST 	01223351938		https://www.omarfaruquemosque.org.uk	0	0	0	1	The Charity has been providing and facilitating congregational prayers. Holding religious and cultural activities for the community. Children are taught Islamic studies on the weekends by a qualified teacher. The organisation takes part in community cohesion programmes with other organisations.
THE MUSLIM WELFARE ASSOCIATION OF CHESTERFIELD AND NORTH DERBYSHIRE	the-muslim-welfare-association-of-chesterfield-and-north-derbyshire	CHESTERFIELD	CHESTERFIELD	S40 1JY	07976352053	contact@muslimwelfarechesterfield.com	https://www.muslimwelfarechesterfield.com	0	0	0	1	innolved in CIF work and running a Luncheon club for the benefit of the Muslim Community of Chesterfield and North East Derbyshire. Also promoting interests of Muslim women within our designated area
BRISTOL MUSLIM CULTURAL SOCIETY	bristol-muslim-cultural-society	BRISTOL	BRISTOL	BS5 0HE	07903700331	bmcs@bmcs.org.uk	https://www.bmcs.org.uk	0	0	0	1	Summary of main objectives:1. Offer drop-in advice advocacy and information to the community on wide range of issues.2. Act as a representative and consultative body for Muslim communities in raising issues of concern to the public, private and voluntary sector.3. Develop activities for young people and women4. Support and develop Muslim infrastructure
HACKNEY ISLAMIC COMMUNITY CENTRE	hackney-islamic-community-centre			E9 6JA	07955162245	info@daarhadeeth.com	https://daarhadeeth.com/	0	0	0	1	We work to advance the Islamic faith for public benefit by maintaining and managing a community centre and mosque, fostering an environment for worship, religious instruction, community engagement and activities. Additionally, we support the education of Muslim children and adults through a supplementary school, offering educational and recreational facilities outside school and work hours.
Quba Islamic Foundation	quba-islamic-foundation	LEICESTER	LEICESTER	LE1 2LP	07544495153	qubaislamicfoundation@gmail.com	https://qubamasjid.org	0	0	0	1	RELIGIOUS ACTIVITIES,EDUCATION. ADVISE AND SUPPORT, RECREATIONAL SERVICES, HEALTH PROMOTION
SHAH JALAL JAMI MASJID	shah-jalal-jami-masjid			WS1 3PJ 	07956800849	info@shahjalal.org	http://www.shahjalaljamemasjid.org	0	0	0	1	Place of Worship No: 77261TO ADVANCE THE ISLAMIC FAITH FOR THE BENEFIT OF THE PUBLIC THROUGH THE HOLDING OF PRAYER MEETINGS, LECTURES, PUBLIC CELEBRATION OF RELIGIOUS FESTIVALS, PRODUCING AND/OR DISTRIBUTING LITERATURE ON THE ISLAMIC FAITH TO ENLIGHTEN OTHERS ABOUT THE ISLAMIC RELIGION.
MUSLIM YOUTHWORK FOUNDATION	muslim-youthwork-foundation	48-52 Floodgate Street,	48-52 Floodgate Street,	B5 5SL	07707914976	info@mywf.org.uk	https://www.mywf.org.uk	0	0	0	1	education in England and Wales
SLOUGH ISLAMIC SCHOOL PROJECT	slough-islamic-school-project	Off Weham Road	Off Weham Road	SL25FF  	07838189380	office@iqra.slough.sch.uk	https://Iqraprimary.com	0	0	0	1	The Charity is a Independent Voluntary Organisation. Its primary objective was to built a three form VA Islamic School by raising funds from Government and donations. Once built (2009) its aim its to continue fundraising and financially supporting the School by provision of additional funds. It is the Foundation Authority for Iqra School (i.e. Iqra Slough Islamic Primary School)
CROYDON ISLAMIC COMMUNITY TRUST	croydon-islamic-community-trust			CR0 2RF	0208 7600552	admin@croydonict.com	https://www.croydonict.com	0	0	0	1	Five daily prayer and friday congregational prayerQuran, Islamic Studies, & Arabic coursesMarriage guidance, support services, relationship counselling and Wedding ceremonies (Nikah)Women training & support servicesYouth training & support servicesMentoring & Local school support and training
JALALIA MOSQUE AND ISLAMIC EDUCATION CENTRE	jalalia-mosque-and-islamic-education-centre	CARDIFF	CARDIFF	CF11 6ER	07921788643	jalaliamosque@live.co.uk	https://jalaliamosque.org.uk	0	0	0	1	Provide & maintain worship facility for Muslims (Sunni - Hanafi Sect of Islam) and education session for children, arrange funeral and generally provide help and support to the needy members of the community.
WEST WALES ISLAMIC CULTURAL ASSOCIATION	west-wales-islamic-cultural-association	carmarthenshire	carmarthenshire	SA31 1LR	01267232661	enquiries@wwica.co.uk	https://www.wwica.co.uk	0	0	0	1	The advancement of the Islamic religion in accordance with the teachings of the Holy Quran and Sunnah of the Prophet Muhammad (peace be upon him).
EAST HAM BANGLADESHI ISLAMIC COMMUNITY TRUST	east-ham-bangladeshi-islamic-community-trust			E6 2PU	07960563488	info@ebict.co.uk	https://www.ebict.co.uk	0	0	0	1	Weekly gathering, fundraising, advice and information, providing food for the fasting in Ramadan, women's group and facilities in local community centre.
NEWBURY PARK MASJID	newbury-park-masjid			IG2 7PY	07941481272	secretary@newburyparkmasjid.org.uk	https://www.npicc.org	0	0	0	1	The objective of the Newbury Park Masjid is the advancement of Islam amongst the people living in the London borough of Redbridge.
LEWSEY MUSLIM CULTURAL SOCIETY	lewsey-muslim-cultural-society			LU4 0QY	01582 213302	admin@zakariyamasjid.org.uk	http://zakariyamasjid.org.uk/	0	0	0	1	The Society serves the religious, social and cultural needs of the local Muslim population living and working in the Lewsey Farm and surrounding areas of Luton in Bedfordshire.  The Society is responsible for the administration of Zakariya Masjid and Madresa-e-Furqaniah and works closely with other local organisations and faith groups for improvements to facilities and services in the community.
BANGOR ISLAMIC CENTRE	bangor-islamic-centre	Gwynedd	Gwynedd	LL57 1NR	07846712803		http://www.nwis.org.uk/bangorislamiccentre	0	0	0	1	Help the Advancement of Islam and Muslims and Establish harmony within the Muslim Community and with other local Communities in North Wales.
SRI LANKAN MUSLIM COMMUNITY FOUNDATION OF MILTON KEYNES	sri-lankan-muslim-community-foundation-of-milton-keynes	MILTON KEYNES	MILTON KEYNES	MK6 2AQ	07939042907	slmcfmk@hotmail.co.uk	https://www.slmcficmk.org.uk	0	0	0	1	Education/TrainingRelief of PovertyReligious activitiesArts/culture
