name	slug	address	city	postcode	phone	email	website	capacity	has_women_section	has_parking	has_wudu	description
MUSLIM HELP UK	muslim-help-uk			RM9 9RY	02036332779	info@muslimhelp.org	https://www.muslimhelp.org	0	0	0	1	Muslim Help is a UK-based international development registered charity and Non-profit Organisation, which strives to help communities tackle many challenges it faces. We are working for Education, Healthcare, Disabled and also providing Emergency Help where needed.
ISLAMIC SOCIETY OF BRITAIN LTD	islamic-society-of-britain-ltd	LONDON	LONDON	EC1V 2NX	03003651098	info@isb.org.uk	https://www.isb.org.uk	0	0	0	1	Our activities range from small local programmes to large national events that attract thousands, and often cater for the whole family. They include, inter alia: inter-faith and inter-community activities; conferences and lectures; study groups; religious and spiritual retreats; educational programmes for Muslims; awareness campaigns for the public; online and physical published resources.
MUSLIM UMMAH	muslim-ummah	LONDON	LONDON	E12 6BT	07544211271	m.ummahcharity@gmail.com	https://www.muslimummah.org.uk	0	0	0	1	THE CHARITY AIMS TO EDUCATE THE MUSLIM COMMUNITY AND THE GENERAL PUBLIC FOR THE BETTER UNDERSTANDING OF ISLAM.
HINDU MUSLIM FORUM	hindu-muslim-forum			N1 7GU  	02071937943		http://www.hindumuslimforum.org/	0	0	0	1	Promotion of religious harmony for the public benefit
AKANJEE FOUNDATION MASJID & ISLAMIC CENTRE	akanjee-foundation-masjid-islamic-centre			IG11 9UG	07930561242		https://www.akanjee-foundation-masjid.org	0	0	0	1	a) Advancement of the Islamic religion for the public benefit in particular but not exclusively by the provision of prayer facilities and the teaching of the Quran. b) Promotion of good health through the provision of information and advice sessions. c) Assist in the provision of facilities in the interests of social welfare for recreation (youth, age infirmity or disability)
YORK WAY MASJID AND COMMUNITY CENTRE	york-way-masjid-and-community-centre			NW1 7HB	02076096755	ywmasjid@gmail.com	http://yorkwaymasjid.org/	0	0	0	1	Daily prayers Supplementary schoolAdvice ServiceYouth ClubAfter School clubAdult learning classesCommunity events
SIKH MUSLIM FORUM	sikh-muslim-forum			N1 7GU  	02071937943	enquiries@sikhmuslimforum.org	http://www.sikhmuslimforum.org/	0	0	0	1	Promotion of religious harmony for the public benefit
AL-HABIB ISLAMIC EDUCATIONAL AND CULTURAL CENTRE SWINDON	al-habib-islamic-educational-and-cultural-centre-swindon			SN2 8DA	01793485896		https://www.al-habib.co.uk	0	0	0	1	PROVIDE BENEFIT TO THE ALL INHABITANTS OF SWINDON, PRIMARILY THE MUSLIMS WITHOUT DISTINCTION OF RELIGION, SEX, RACE OR OTHER OPINIONS.WORK WITH AUTHORITIES, VOLUNTARY ORGANISATIONS IN COMMON EFFORT FOR THE BENEFIT OF THE PUBLICEDUCATE IN CITIZENSHIP & INTEGRATED LIVINGPROVIDE FACILITIES FOR WORSHIP, RECREATION OR OTHER LEISURE TIMEADVISORY SERVICE FOR COMMON BENEFIT, ADVISE, DIRECT, HELP
JAMIA MASJID RIZVIA BRIERLEY HILL	jamia-masjid-rizvia-brierley-hill	BRIERLEY HILL	BRIERLEY HILL	DY5 3EE	01384869442	info@jmrbrierleyhill.co.uk	https://www.jmrbrierleyhill.co.uk	0	0	0	1	The charity provided prayer facilities for local community. The other activities include providing the the local community with Islamic education as well as promoting Islamic values within wider community.
ROCHDALE COUNCIL OF MOSQUES	rochdale-council-of-mosques			OL16 9AT	01706 655322	info@rcom.org.uk	https://www.rcom.org.uk	0	0	0	1	Our Activities and Achievements ? Safeguarding Training for all Imams? Respect for All Religions? Birthday of the Prophet Celebrations? Islam Awareness Training? Spoken Urdu Training? Inter Mosque Competition? Drugs Awareness Training? Fire Safety Awareness? Cemetery Consultation? Cancer Awareness Training
REDHILL ISLAMIC CENTRE / JAMIA MASJID AL-MUSTAFA	redhill-islamic-centre-jamia-masjid-al-mustafa	REDHILL	REDHILL	RH1 6HW	01737760251	info@surreymosque.com	https://www.redhillmosque.co.uk	0	0	0	1	Islamic Religious Services, Activities, Lectures and Training, Islamic Schools, Mosque Visits, Nikah & Civil Registration, Death and Burials, General Services, Advice & Counsel, Spiritualism, Aqeedha & Fiqh, Community Cohesion, Seminars, Relief of poverty, Interfaith dialogue liaison with the local community and addressing matters of social welfare and other service required by the community.
WATFORD MUSLIM YOUTH CENTRE	watford-muslim-youth-centre			WD18 7DU	07894093248	admin@wmyct.com	https://www.wmyct.com	0	0	0	1	Benefit the residents of Watford  by associating together the residents and the local authorities, voluntary and other organisations in a common effort to advance education and to provide facilities in the interests of social welfare for recreation leisure time occupation with the objective of improving the conditions of life for the residents.
DARUL IHSAN ISLAMIC CENTRE	darul-ihsan-islamic-centre			OL16 2EB	01706559081	ahnessa@hotmail.co.uk	http://darul-ihsan.co.uk	0	0	0	1	The charity's main aims are to promote the physical and mental health of children, women and orphans in Bangladesh through the provision of financial assistance, support, education, accommodation, food and medical treatment.
HEREFORD ISLAMIC SOCIETY	hereford-islamic-society			HR4 9SP	+447894350027	H.I.S.786@HOTMAIL.COM	http://www.herefordmasjid.com	0	0	0	1	Raising finances to purchase a community centre.
NAUMAANIAH ISLAMIC EDUCATION TRUST	naumaaniah-islamic-education-trust	BRADFORD	BRADFORD	BD8 7ER	07875050306	Naumaaniahtrust@gmail.com	https://Www.niet.co.uk	0	0	0	1	Charity is undertaking activities to establish long term premises from which to run charitable activities.
GILLANI NOOR MASJID	gillani-noor-masjid	STOKE-ON-TRENT	STOKE-ON-TRENT	ST3 4QS	07525049616	info@gillaninoormasjid.co.uk	https://gillaninoormasjid.co.uk	0	0	0	1	a mosque (place of worship).
CORBY MUSLIM ASSOCIATION	corby-muslim-association			NN17 1RL	07733787271	corbycentralmasjid@hotmail.com	http://www.corbycentralmasjid.co.uk	0	0	0	1	1) To advance the Islamic religion in Corby for the benefit of the public through the holding of prayer meetings, lectures, the conducting of all religious and social activities in accordance with the Holy Quran and Sunnah, and producing and/or distributing literature on Islamic values to enlighten others about the Islamic religion.
MUSLIMS FUNERAL SERVICES LTD	muslims-funeral-services-ltd	LONDON	LONDON	SW16 6LY	07852268014	info@mfs.org.uk	http://www.mfs.org.uk/	0	0	0	1	Visit the families who just suffered a loss in their family to comfort and guide them through the funeral process.On behalf of the families we make the necessary arrangements for funeralTo complete the necessary tasks in a short time we pay for the cost of the funeral and the costs are then reimbursed by the familyProvide post burial support.If any Muslim has no next of kin,through donations
THE MUSLIM CULTURAL SOCIETY OF LEEDS	the-muslim-cultural-society-of-leeds	CONWAY ROAD	CONWAY ROAD	LS8 5JH 	01132407695	info@bilalmasjid.org.uk	https://www.bilalmasjid.org.uk	0	0	0	1	To promote the social, cultural, religious and educational aspirations of Muslims living in Leeds, With a clear vision to develop  a more cohesive and sustainable community by building partnerships with the local people of Leeds and the region.
PRESTON MUSLIM SOCIETY, MASJID-E-SALAAM	preston-muslim-society-masjid-e-salaam	Fulwood	Fulwood	PR2 9PL	01772788200	admin@masjidesalaam.org.uk	http://www.masjidesalaam.org.uk/	0	0	0	1	Mosque and advancement of religious education
JAMIA MASJID MADINA COLNE	jamia-masjid-madina-colne	LANCASHIRE	LANCASHIRE	BB8 0SE	01282860196	madinamasjidcolne@gmail.com	https://www.madinamasjidcolne.org	0	0	0	1	Facilities and services are provided for the local community to offer their prayers and practice their faith alone or in congregation.  Classes are provided for children and adults to learn the Quran and study about religious education and citizenship.  Annual Islamic festivals are celebrated and meetings of inter faith activities.
KILBURN ISLAMIC CENTRE LTD	kilburn-islamic-centre-ltd	LONDON	LONDON	NW6 2DB	020 3952 3212	enquiries@thekic.org	https://www.thekic.org	0	0	0	1	The activities of the charity are to encourage Islamic culture by providing location and other facilities for local community to congregate and offer prayers sessions the charity also run after school class providing Islamic educational services to young and adult members.
DARUL IKHLAS	darul-ikhlas			NW2 7NG	07958692871	ifti92@yahoo.com	http://www.darulikhlas.org.uk	0	0	0	1	We are committed to establishing a Mosque & Islamic cultural centre in Isleworth, London, insh'Allah. Activities include the five daily prayers, the weekly jumu'a prayer and annual 'Id celebrations, regular Islamic and Qur'anic classes for children of all ages, youth activities including sports and summer camps, adult projects and education programmes for men and women, and interfaith initiatives.
LAMBETH MASJID & PROGRESSIVE COMMUNITY CENTRE	lambeth-masjid-progressive-community-centre			SE13 7AP	07534392953	194lambethmasjid@googlemail.com	https://www.lambethmasjid.com	0	0	0	1	WE PROVIDE PRAYER SERVICES, EDUCATIONAL AND SOCIAL SERVICES.
MUSLIM WELFARE TRUST	muslim-welfare-trust			NN3 8YE	07453757566	admin@muslimwelfaretrust.org	https://www.muslimwelfaretrust.org	0	0	0	1	Establish a mosque for worship for Muslims and Madrassah teaching Islamic education to children. the charity will relieve the financial hardship in countries as Somalia, Tanzania, Kenya, Uganda by providing Food and water, Education, Healthcare, angLivelihoods.
BIRMINGHAM MUSLIM BURIAL COUNCIL	birmingham-muslim-burial-council	BIRMINGHAM	BIRMINGHAM	B42 1EP	07846100482	info@bmbc.org.uk	https://www.bmbc.org.uk	0	0	0	1	BMBC aims to act as a single point of contact providing, guidance and material, for an effective, efficient and dignified burial. The charity has provided advice to families from all faiths and none, in conducting and liaising with authorities through the burial processes.BMBC has hosted national and local conferences engaging local authorities and community groups across Birmingham.
JAMIA REHMANIA RAZWIYYAH	jamia-rehmania-razwiyyah	NELSON	NELSON	BB9 0BH	07761707613	info@myncm.co.uk	https://www.myncm.co.uk	0	0	0	1	The main objective of the charity is the provision of services to eliminate poverty, to promote wellbeing and the advancement of Islamic education. The provision of these services is to make a positive social impact in order to boost health, education and build a support network for the communities we operate in. The Charity also operates a foodbank and provides other support to those in need.
CAPEHILL MUSLIM SOCIETY	capehill-muslim-society			B66 4PX	07894745700	enquiry@masjidusman.org.uk	https://www.masjidusman.org.uk	0	0	0	1	Availability of Mosque for daily prayers, provides lectures as part of adult education programme, offer adults education for females, offer counselling to families and youngster?s, accept school visits and participate in interfaith dialogues
CHELSEA MUSLIM COMMUNITY HUB	chelsea-muslim-community-hub	LONDON	LONDON	SW10 0DS	02070181313	info@chelseamuslims.org.uk	https://www.chelseamuslims.org.uk	0	0	0	1	Promotes family values, religious tolerance, integration and freedom of expression.Opposes extremism, radicalisation, hate preaching and violence.Provides prayer facilities, Arabic and Quran lessons, social and religious consultations plus humanitarian aid.Contributes to Council activities in education, residents association, evaluation of Services, prevent policy and community engagement.
SOCIETY OF MUSLIM HEALTHCARE WORKERS	society-of-muslim-healthcare-workers	BIRMINGHAM	BIRMINGHAM	B16 0ND	07894243413	info@muslimhealthservice.com	https://www.muslimhealthservice.com	0	0	0	1	Build networks between healthcare professionals to offer career guidance, and advice and a forum to discuss ethical and spiritual issues.  Building a database of healthcare issues for Muslims including common dilemmas. Organise workshops to improve awareness regarding Islamic beliefs and their relevance in healthcare to improve the care received by Muslim patients.
MASJID BILAL MUDDRASA THALIM UL QURAN AND COMMUNITY CENTRE	masjid-bilal-muddrasa-thalim-ul-quran-and-community-centre	Balsall Heath	Balsall Heath	B12 9NS	01214466210	masjidbilaal@hotmail.com	https://masjidbilaal.com/	0	0	0	1	Place of muslim worship and local community centre.
GOSPORT ISLAMIC SOCIETY	gosport-islamic-society	Gosport	Gosport	PO13 8DJ	02392716593	lordlukman@gmail.com	http://www.gosportislamicsociety.co.uk/	0	0	0	1	The Society runs weekly prayer meetings on Fridays at St Mary's CofE Church, Rowner.  These prayers are attended by around 60 members and the Imam also gives separate instruction in memorisation of the Quaran and in Sharia law to 7 young people.  The strategic aim of the group is to raise sufficient funds to buy a building to create a Mosque for Gosport.
THE EUROPEAN ASSOCIATION FOR ISLAMIC INSTITUTIONS	the-european-association-for-islamic-institutions			W1H 1BY	02073468640	theeuropeanassociation@gmail.com	http://theeuropeanassociation.com	0	0	0	1	THE ADVANCEMENT OF THE ISLAMIC RELIGION; INCLUDING THE SUPPORT OF CHARITABLE ISLAMIC SOCIETIES AND INSTITUTIONS, THE PROMOTION OF ISLAMIC EDUCATION AND PRACTICE, THE PROPAGATION OR DISSEMINATION OF ISLAMIC RELIGIOUS WORKS AND THE PROVISION OR MAINTENANCE OF FACILITIES FOR ISLAMIC WORSHIP OR ISLAMIC EDUCATION IN THE INTERESTS OF MORAL AND/OR SPIRITUAL WELFARE OR IMPROVEMENT OF THE GENERAL PUBLIC.
Baitul Ma'mur Jami Masjid & Bangladeshi Islamic Centre	baitul-mamur-jami-masjid-bangladeshi-islamic-centre	NORTHAMPTON	NORTHAMPTON	NN5 5LJ	07984148897	secretary@bmjm.co.uk	https://www.bmjm.co.uk	0	0	0	1	MOSQUE AND COMMUNITY CENTRESOCIAL CULTURAL AND RECREATIONAL ACTIVITIES, LANGUAGE CLASSES AND RELIGIOUS STUDIES
SHREWSBURY MUSLIM CENTRE	shrewsbury-muslim-centre	2 Preston Street	2 Preston Street	SY2 5NY	07958916010	info@shrewsburymuslimcentre.org	https://www.shrewsburymuslimcentre.org	0	0	0	1	Advance the Muslim religion for the benefit of the public through the holding of prayer meetings,lectures and public celebration of religious festivals;To Further or benefit the residents of Shrewsbury and the neighbourhood, without distinction of sex,sexual orientation, race or of political, religious or other opinions by associating together the said residentsand the local authorities.
HARROGATE ISLAMIC ASSOCIATION LIMITED	harrogate-islamic-association-limited	Harrogate	Harrogate	HG1 4BA	07515020458	Info@harrogatemuslims.org	http://harrogatemuslims.org/	0	0	0	1	The mission of the Harrogate Islamic Association is to provide support and social network for the Muslims living and working in the Harrogate District. To Promote and foster cross cultural understanding and harmony and to provide educational and communal facilities for Adults and children.
HAMMERSMITH ISLAMIC ASSOCIATION	hammersmith-islamic-association	Unimix House Business Centre	Unimix House Business Centre	London	02086386424	info@hammersmithmasjid.org	https://www.hammersmithmasjid.org	0	0	0	1	THE AIMS AND OBJECTIVES FOR WHICH THE HIA IS FORMED ARE:A. TO ADVANCE THE ISLAMIC RELIGION IN ACCORDANCE WITH ITS STATEMENT OF BELIEFS; B. TO RELIEVE FINANCIAL HARDSHIP OF SUCH MEMBERS OF THE COMMUNITY WHO ARE POOR AND IN NEED.
ERITREAN MUSLIM COMMUNITY ASSOCIATION UK	eritrean-muslim-community-association-uk			SW8 2ND	02077202508	info@emca.org.uk	https://www.emca.org.uk	0	0	0	1	Youth Programs/Club, Arabic/Islamic classes, IT courses, GCSE Prep classes, Cultural/Social Events, Personal Development, Health Workshops
READING ISLAMIC CULTURAL CENTRE	reading-islamic-cultural-centre			RG1 3LB	07850373048	info@crmasjid.org	https://www.crmasjid.org	0	0	0	1	To help poor and needy peopleTo help young people for sports and to further cultural activitiesTo provide place for worship and religious functionsActivities are in Reading and surrounding areas
GRANTHAM MUSLIM COMMUNITY ASSOCIATION	grantham-muslim-community-association	GRANTHAM	GRANTHAM	NG31 6RE	07985403592	info@granthamislamiccentre.org	https://www.granthamislamiccentre.org	0	0	0	1	The advancement of the Islamic religion by providing a designated place of worship for Muslim residents. The promotion of education and of of religious harmony by providing education and information on Islam and social issues for both Muslims and non-Muslims.
EASTBOURNE ISLAMIC CULTURAL CENTRE	eastbourne-islamic-cultural-centre	EASTBOURNE	EASTBOURNE	BN21 3TX	07886131518	eastbournemosque@yahoo.co.uk	https://www.eastbournemosque.com	0	0	0	1	To promote Islam in Eastbourne To provide a place of worshipTo educate adults and children in Islamic principles and practicesTo participate in the wider community and multi-faiths activities
LANSBURY ESTATE MUSLIM ASSOCIATION	lansbury-estate-muslim-association			E14 6BZ 	07931141291	Lansburymosque@gmail.com	https://www.lansburymasjid.co.uk	0	0	0	1	TO ADVANCE THE ISLAMIC FAITH FOR THE PUBLIC BENEFIT IN SUCH WAYS AS THE TRUSTEES SHALL DEEM FIT. THE ADVANCEMENT OF EDUCATION AND TRAINING, INCLUDING RELIGIOUS EDUCATION. THE PROMOTION OF RACIAL HARMONY FOR THE PUBLIC BENEFIT BY: PROMOTING KNOWLEDGE AND MUTUAL UNDERSTANDING BETWEEN DIFFERENT RACIAL GROUPS; ADVANCING EDUCATION AND RAISING AWARENESS ABOUT DIFFERENT RACIAL GROUPS TO PROMOTE GOOD
NOOR DEEN ISLAMIC ASSOCIATION	noor-deen-islamic-association			HA0 2FL	07725616390	noordeenuk@yahoo.co.uk	https://www.noordeen.org	0	0	0	1	Members hold a monthly meeting on the first saturday of each month. During meetings, progress discussions are held, update information announced, completed tasks or assignment report submitted and the agenda for the next meeting set. Members contribute a minimum of ?10 per month. Contributions collected by treasurer.
GARDENS OF PEACE MUSLIM CEMETERY	gardens-of-peace-muslim-cemetery			IG1 3PB	02085545937	info@gardens-of-peace.org.uk	http://www.gardens-of-peace.org.uk	0	0	0	1	PROVISION OF BURIAL SERVICES TO THE MUSLIM COMMUNITY
DARUL JANNAH TRUST AND STRATFORD MUSLIM CENTRE LIMITED	darul-jannah-trust-and-stratford-muslim-centre-limited	LONDON	LONDON	E15 3EU	07786261109	daruljannahtrust_smc@outlook.com	https://www.djtasmc.com	0	0	0	1	Education & training
EUROPE MUSLIM ASSOCIATION	europe-muslim-association			B9 5TY	07775883002	nema.information@gmail.com	https://www.nema.eu.com	0	0	0	1	The Europe Muslim Association are active and Activities of religious organizations.
WEST NORWOOD MUSLIM COMMUNITY PROJECT	west-norwood-muslim-community-project			SM5 2FH	07926998370	info@wnmcp.org.uk	https://www.wnmcp.org.uk	0	0	0	1	We provide a community base for the Muslim population of West NorwoodWe provide weekly Friday prayers in West Norwood and Eid Prayers biannually. We provide Islamic education for adults and childrenWe hold Muslim community eventsWe facilitate activities during Ramadan, including:a) Iftar mealb) Special night prayersc) Suhur meald) Qur'an classes and Islamic education
MUSLIM COMMUNITY & EDUCATION CENTRE (MCEC)	muslim-community-education-centre-mcec			N13 5JL 	02089203990	enquiries@mcec.org.uk	https://www.mcec.org.uk	0	0	0	1	- To advance the religion of Islam for the benefit of the Public- Advance the knowlege and education of the general public in Quranic, Arabic and Islamic Studies- To develop the capacity and skills of the members of society and economically disadvantage Muslim community in the London Borough of Enfield, Barnet and surroundings
JAMIA MASJID AND ISLAMIC CENTRE SLOUGH	jamia-masjid-and-islamic-centre-slough	SLOUGH	SLOUGH	SL1 3NY	01753522561	info@jmicslough.org	https://www.jmicslough.org	0	0	0	1	Five daily and Friday prayersFuneral PrayersIslamic Marriage CeremoniesAdult's and Chidren's educationLadies ClassesOrganised visits from Schools in the Berkshire and Buckinghamshire Counties.Multi/Inter Faith visits and meetings
MARKAZ QUBA	markaz-quba	7 Corsican Square	7 Corsican Square	E3 3YD	07572523182	admin@markazquba.com	http://www.markazquba.com/	0	0	0	1	Promoting the:1) education and welfare of girls and boys in Nepal.2) welfare of local communities in Nepal.
WELWYN ISLAMIC SOCIETY	welwyn-islamic-society	Martinfield Business Centre	Martinfield Business Centre	AL7 1HG	01707300267	idrees.iqbs@googlemail.com	https://www.welwynis.org	0	0	0	1	Running charitable events for the local community in the Welwyn Garden City including holding of prayers meetings, lectures, public celebration of religious festivities, producing or distributing literature to enlighten the general public on Islam. Islamic education for the young in the local community.
MUSLIM BEREAVEMENT SUPPORT SERVICE	muslim-bereavement-support-service	ILFORD	ILFORD	IG1 9UX	02034687333	info@mbss.org.uk	http://www.mbss.org.uk/	0	0	0	1	We are a non-profit organisation serving the Muslim community by supporting bereaved mothers who have lost a child at any stage.
Carlisle Islamic Centre	carlisle-islamic-centre	Cumbria	Cumbria	CA1 2JA	07779581182	carlisleislamiccentre@outlook.com	https://www.carlisleislamiccentre.org	0	0	0	1	The advancement of the Muslim Religion and in particular, but not so as to limit the generality of the foregoing, the promotion of cultural, religious and social programmes among the members, their families and children.The promotion of the Muslim Religion and the advancement of education in accordance with the doctrines of the Muslim Religion.The promotion of good relations in communities
MADNI MUSLIM COMMUNITY CENTRE TRUST	madni-muslim-community-centre-trust	BROADWAY	BROADWAY	CF24 1PU	02920487667	madnicardiff@gmail.com	https://madnicardiff.co.uk	0	0	0	1	Teaching Mother Tongue, Arabic and Quranic Classes for Adults and ChildrenStudy Circles for Adults Men & WomenSocial Gatherings for Community Co Hesion, Interfaith activities
MADRASSA FAIZ-E-RAZA	madrassa-faiz-e-raza			LE5 3DF	0797770089		https://www.faiz-e-raza.org	0	0	0	1	We aim to provide a platform for children and adults to excel by developing education and morals which can transform lives and communities.  Inspired by our dedication to continuous learning and with the support of parents, staff and the community, we aim for each person to reach their full potential and be equipped to meet the challenges of work and life.
WEST LONDON ISLAMIC CULTURAL CENTRE	west-london-islamic-cultural-centre	Fulham	Fulham	SW6 4HW	02074718264	info@wlicc.org	https://www.wlicc.org	0	0	0	1	In the heart of Hammersmith & Fulham we serve a local community of varying ages, backgrounds, and abilities. Our centre is  always keen on developing the services it provides to its community  and as the community gets bigger, so have our operations. Throughout the years our centre has grown from a local mosque into one of the UK?s leading Islamic Centres. We attract more than 4,000 users a week.
BURY ST EDMUNDS ISLAMIC CULTURAL ORGANISATION	bury-st-edmunds-islamic-cultural-organisation	Suffolk	Suffolk	IP33 3NZ	07377548673	info.bsebico@gmail.com	https://www.bico.onesuffolk.net	0	0	0	1	We seek to provide a range of services for local Muslims to engage within the wider community of Bury St Edmunds & West Suffolk. We believe in putting people first and serving all communities, irrespective of faith, gender and ethnicity. We are for social inclusion, education, respect and are for building a tolerant and stronger Britain.
Muslim Women's Network UK	muslim-womens-network-uk	BIRMINGHAM	BIRMINGHAM	B28 8AB	01212369000	contact@mwnuk.co.uk	https://www.mwnuk.co.uk	0	0	0	1	Promoting equality and diversity, social inclusion and religious and racial harmony through providing information, advice and support to service users, service providers and wider community as well as undertaking research into key issues of importance and facilitating training and forums.
WOODFORD MUSLIM CULTURAL CENTRE LTD	woodford-muslim-cultural-centre-ltd			IG8 7HY 	07748945638	woodfordmuslim_cc@yahoo.com	http://www.wmccuk.org/	0	0	0	1	Organise seminars and conferences covering issues of religious and communal responsibilities.Conduct religious programmes and worship.Please refer to Trustees' report for more details.
INCLUSIVE MOSQUE INITIATIVE	inclusive-mosque-initiative	LONDON	LONDON	N1 9AB	02031891185	admin@inclusivemosque.org	https://www.inclusivemosque.org	0	0	0	1	To teach the spirit, culture, philosophy, ethics and fundamentals of Islam, with a view to improving the moral, intellectual and social condition of Muslims in their community.To expand the knowledge of Islam through discussions and Islamic literature by means of publishing and distributing such literature, and provide an Islamic resource facility for communities at large.
PRESTON MUSLIM SOCIETY, QUWWATUL ISLAM MASJID	preston-muslim-society-quwwatul-islam-masjid	LANCASHIRE	LANCASHIRE	PR1 6QQ	01772254578	charity@quwwatulislam.org.uk	https://www.quwwatulislam.org.uk	0	0	0	1	The Charity makes provisions for all religious and cultural requirements of the society's members and the general public by maintaining the Masjid and Madrassah premises. The activities and services provided include Daily prayers, Funeral and burial services, Nikah ceremonies, Religious Education and many other religious ceremonies.
JAMEA DARUL HUDA SYLHET	jamea-darul-huda-sylhet			BB1 1ER	07723329082		https://www.jameadarulhuda.com	0	0	0	1	The Charity provides governance support and advice to the Orphanage in Sylhet. The Charity also provides grants for the educational and social development of the students in the orphanage and people from the local area of Mominkhala West, Sylhet.  The Charity provides specific programmes, educational and social, for the development of students and the local community.
WORKSOP ISLAMIC SOCIETY TRUST	worksop-islamic-society-trust			S80 2BE 	07703297032	info@wist.org.uk	https://www.wist.org.uk	0	0	0	1	PROVIDE RELIGIOUS, SOCIAL AND WELL BEING FOR THE MUSLIM COMMUNITY IN THE WORKSOP AREA
